Item Title,Publication Title,Book Series Title,Journal Volume,Journal Issue,Item DOI,Authors,Publication Year,URL,Content Type
"RuBQ: A Russian Dataset for Question Answering over Wikidata","The Semantic Web – ISWC 2020","","","","10.1007/978-3-030-62466-8_7","Vladislav KorablinovPavel Braslavski","2020","http://link.springer.com/chapter/10.1007/978-3-030-62466-8_7","Chapter"
"An Introduction to Question Answering over Linked Data","Reasoning Web. Reasoning on the Web in the Big Data Era","","","","10.1007/978-3-319-10587-1_2","Christina UngerAndré FreitasPhilipp Cimiano","2014","http://link.springer.com/chapter/10.1007/978-3-319-10587-1_2","Chapter"
"RuBQ 2.0: An Innovated Russian Question Answering Dataset","The Semantic Web","","","","10.1007/978-3-030-77385-4_32","Ivan RybinVladislav KorablinovPavel EfimovPavel Braslavski","2021","http://link.springer.com/chapter/10.1007/978-3-030-77385-4_32","Chapter"
"Multilingual Question Answering over Linked Data (QALD-3): Lab Overview","Information Access Evaluation. Multilinguality, Multimodality, and Visualization","","","","10.1007/978-3-642-40802-1_30","Philipp CimianoVanessa LopezChristina UngerElena CabrioAxel-Cyrille Ngonga NgomoSebastian Walter","2013","http://link.springer.com/chapter/10.1007/978-3-642-40802-1_30","Chapter"
"Introduction to Linked Data and Its Lifecycle on the Web","Reasoning Web. Reasoning on the Web in the Big Data Era","","","","10.1007/978-3-319-10587-1_1","Axel-Cyrille Ngonga NgomoSören AuerJens LehmannAmrapali Zaveri","2014","http://link.springer.com/chapter/10.1007/978-3-319-10587-1_1","Chapter"
"Linked Data","The Web of Data","","","","10.1007/978-3-030-51580-5_8","Aidan Hogan","2020","http://link.springer.com/chapter/10.1007/978-3-030-51580-5_8","Chapter"
"7th Open Challenge on Question Answering over Linked Data (QALD-7)","Semantic Web Challenges","","","","10.1007/978-3-319-69146-6_6","Ricardo UsbeckAxel-Cyrille Ngonga NgomoBastian HaarmannAnastasia KritharaMichael RöderGiulio Napolitano","2017","http://link.springer.com/chapter/10.1007/978-3-319-69146-6_6","Chapter"
"Introduction","Managing Data From Knowledge Bases: Querying and Extraction","","","","10.1007/978-3-319-94935-2_1","Wei Emma ZhangQuan Z. Sheng","2018","http://link.springer.com/chapter/10.1007/978-3-319-94935-2_1","Chapter"
"Cross-Lingual Natural Language Querying over the Web of Data","Natural Language Processing and Information Systems","","","","10.1007/978-3-642-38824-8_13","Nitish AggarwalTamara PolajnarPaul Buitelaar","2013","http://link.springer.com/chapter/10.1007/978-3-642-38824-8_13","Chapter"
"Introduction to Linked Data and Its Lifecycle on the Web","Reasoning Web. Semantic Technologies for Intelligent Data Access","","","","10.1007/978-3-642-39784-4_1","Sören AuerJens LehmannAxel-Cyrille Ngonga NgomoAmrapali Zaveri","2013","http://link.springer.com/chapter/10.1007/978-3-642-39784-4_1","Chapter"
"HAWK – Hybrid Question Answering Using Linked Data","The Semantic Web. Latest Advances and New Domains","","","","10.1007/978-3-319-18818-8_22","Ricardo UsbeckAxel-Cyrille Ngonga NgomoLorenz BühmannChristina Unger","2015","http://link.springer.com/chapter/10.1007/978-3-319-18818-8_22","Chapter"
"SPBERT: an Efficient Pre-training BERT on SPARQL Queries for Question Answering over Knowledge Graphs","Neural Information Processing","","","","10.1007/978-3-030-92185-9_42","Hieu TranLong PhanJames AnibalBinh T. NguyenTruong-Son Nguyen","2021","http://link.springer.com/chapter/10.1007/978-3-030-92185-9_42","Chapter"
"VQuAnDa: Verbalization QUestion ANswering DAtaset","The Semantic Web","","","","10.1007/978-3-030-49461-2_31","Endri KacupajHamid ZafarJens LehmannMaria Maleshkova","2020","http://link.springer.com/chapter/10.1007/978-3-030-49461-2_31","Chapter"
"QUANT - Question Answering Benchmark Curator","Semantic Systems. The Power of AI and Knowledge Graphs","","","","10.1007/978-3-030-33220-4_25","Ria Hari GusmitaRricha JalotaDaniel VollmersJan ReinekeAxel-Cyrille Ngonga NgomoRicardo Usbeck","2019","http://link.springer.com/chapter/10.1007/978-3-030-33220-4_25","Chapter"
"6th Open Challenge on Question Answering over Linked Data (QALD-6)","Semantic Web Challenges","","","","10.1007/978-3-319-46565-4_13","Christina UngerAxel-Cyrille Ngonga NgomoElena Cabrio","2016","http://link.springer.com/chapter/10.1007/978-3-319-46565-4_13","Chapter"
"AMUSE: Multilingual Semantic Parsing for Question Answering over Linked Data","The Semantic Web – ISWC 2017","","","","10.1007/978-3-319-68288-4_20","Sherzod HakimovSoufian JebbaraPhilipp Cimiano","2017","http://link.springer.com/chapter/10.1007/978-3-319-68288-4_20","Chapter"
"Learning to Rank Query Graphs for Complex Question Answering over Knowledge Graphs","The Semantic Web – ISWC 2019","","","","10.1007/978-3-030-30793-6_28","Gaurav MaheshwariPriyansh TrivediDenis LukovnikovNilesh ChakrabortyAsja FischerJens Lehmann","2019","http://link.springer.com/chapter/10.1007/978-3-030-30793-6_28","Chapter"
"Expressive and Scalable Query-Based Faceted Search over SPARQL Endpoints","The Semantic Web – ISWC 2014","","","","10.1007/978-3-319-11915-1_28","Sébastien Ferré","2014","http://link.springer.com/chapter/10.1007/978-3-319-11915-1_28","Chapter"
"Requirements to Modern Semantic Search Engine","Knowledge Engineering and Semantic Web","","","","10.1007/978-3-319-45880-9_25","Ricardo UsbeckMichael RöderPeter HaaseArtem KozlovMuhammad SaleemAxel-Cyrille Ngonga Ngomo","2016","http://link.springer.com/chapter/10.1007/978-3-319-45880-9_25","Chapter"
"Question Answering over Knowledge Bases","The Semantic Web: ESWC 2018 Satellite Events","","","","10.1007/978-3-319-98192-5_47","Lucia Siciliani","2018","http://link.springer.com/chapter/10.1007/978-3-319-98192-5_47","Chapter"
"Introduction to Linked Data and Its Lifecycle on the Web","Reasoning Web. Semantic Technologies for the Web of Data","","","","10.1007/978-3-642-23032-5_1","Sören AuerJens LehmannAxel-Cyrille Ngonga Ngomo","2011","http://link.springer.com/chapter/10.1007/978-3-642-23032-5_1","Chapter"
"QAnswer KG: Designing a Portable Question Answering System over RDF Data","The Semantic Web","","","","10.1007/978-3-030-49461-2_25","Dennis DiefenbachJosé Giménez-GarcíaAndreas BothKamal SinghPierre Maret","2020","http://link.springer.com/chapter/10.1007/978-3-030-49461-2_25","Chapter"
"Cross Lingual Semantic Search by Improving Semantic Similarity and Relatedness Measures","The Semantic Web – ISWC 2012","","","","10.1007/978-3-642-35173-0_26","Nitish Aggarwal","2012","http://link.springer.com/chapter/10.1007/978-3-642-35173-0_26","Chapter"
"Multilingual Natural Language Interaction with Semantic Web Knowledge Bases and Linked Open Data","Towards the Multilingual Semantic Web","","","","10.1007/978-3-662-43585-4_13","Mariana DamovaDana DannéllsRamona EnacheMaria MatevaAarne Ranta","2014","http://link.springer.com/chapter/10.1007/978-3-662-43585-4_13","Chapter"
"Building a Large Scale Knowledge Base from Chinese Wiki Encyclopedia","The Semantic Web","","","","10.1007/978-3-642-29923-0_6","Zhichun WangZhigang WangJuanzi LiJeff Z. Pan","2012","http://link.springer.com/chapter/10.1007/978-3-642-29923-0_6","Chapter"
"ParaQA: A Question Answering Dataset with Paraphrase Responses for Single-Turn Conversation","The Semantic Web","","","","10.1007/978-3-030-77385-4_36","Endri KacupajBarshana BanerjeeKuldeep SinghJens Lehmann","2021","http://link.springer.com/chapter/10.1007/978-3-030-77385-4_36","Chapter"
"Mind the Cultural Gap: Bridging Language-Specific DBpedia Chapters for Question Answering","Towards the Multilingual Semantic Web","","","","10.1007/978-3-662-43585-4_9","Elena CabrioJulien CojanFabien Gandon","2014","http://link.springer.com/chapter/10.1007/978-3-662-43585-4_9","Chapter"
"Developing a Multilingual Application Using Linked Data: A Case Study","Computational Collective Intelligence. Technologies and Applications","","","","10.1007/978-3-642-40495-5_13","Shingo KinomuraKazuhiro Kuwabara","2013","http://link.springer.com/chapter/10.1007/978-3-642-40495-5_13","Chapter"
"Web of Data","The Web of Data","","","","10.1007/978-3-030-51580-5_2","Aidan Hogan","2020","http://link.springer.com/chapter/10.1007/978-3-030-51580-5_2","Chapter"
"Entity Enabled Relation Linking","The Semantic Web – ISWC 2019","","","","10.1007/978-3-030-30793-6_30","Jeff Z. PanMei ZhangKuldeep SinghFrank van HarmelenJinguang GuZhi Zhang","2019","http://link.springer.com/chapter/10.1007/978-3-030-30793-6_30","Chapter"
"Semantic Search over Documents and Ontologies","Bridging Between Information Retrieval and Databases","","","","10.1007/978-3-642-54798-0_2","Kalina BontchevaValentin TablanHamish Cunningham","2014","http://link.springer.com/chapter/10.1007/978-3-642-54798-0_2","Chapter"
"AMAL: Answering French Natural Language Questions Using DBpedia","Semantic Web Challenges","","","","10.1007/978-3-319-69146-6_9","Nikolay RadoevMathieu TremblayMichel GagnonAmal Zouaq","2017","http://link.springer.com/chapter/10.1007/978-3-319-69146-6_9","Chapter"
"Exploring Term Networks for Semantic Search over RDF Knowledge Graphs","Metadata and Semantics Research","","","","10.1007/978-3-319-49157-8_22","Edgard MarxKonrad HöffnerSaeedeh ShekarpourAxel-Cyrille Ngonga NgomoJens LehmannSören Auer","2016","http://link.springer.com/chapter/10.1007/978-3-319-49157-8_22","Chapter"
"DC Proposal: Automatically Transforming Keyword Queries to SPARQL on Large-Scale Knowledge Bases","The Semantic Web – ISWC 2011","","","","10.1007/978-3-642-25093-4_29","Saeedeh Shekarpour","2011","http://link.springer.com/chapter/10.1007/978-3-642-25093-4_29","Chapter"
"Querying Multilingual DBpedia with QAKiS","The Semantic Web: ESWC 2013 Satellite Events","","","","10.1007/978-3-642-41242-4_23","Elena CabrioJulien CojanFabien GandonAmine Hallili","2013","http://link.springer.com/chapter/10.1007/978-3-642-41242-4_23","Chapter"
"User Interface for a Template Based Question Answering System","Knowledge Engineering and the Semantic Web","","","","10.1007/978-3-642-41360-5_21","Konrad HöffnerChristina UngerLorenz BühmannJens LehmannAxel-Cyrille Ngonga NgomoDaniel GerberPhillip Cimiano","2013","http://link.springer.com/chapter/10.1007/978-3-642-41360-5_21","Chapter"
"EventKG: A Multilingual Event-Centric Temporal Knowledge Graph","The Semantic Web","","","","10.1007/978-3-319-93417-4_18","Simon GottschalkElena Demidova","2018","http://link.springer.com/chapter/10.1007/978-3-319-93417-4_18","Chapter"
"Knowledge Graph Foundations","Exploiting Linked Data and Knowledge Graphs in Large Organisations","","","","10.1007/978-3-319-45654-6_2","Boris Villazon-TerrazasNuria Garcia-SantaYuan RenAlessandro FaraottiHonghan WuYuting ZhaoGuido VetereJeff Z. Pan","2017","http://link.springer.com/chapter/10.1007/978-3-319-45654-6_2","Chapter"
"Improving Answer Type Classification Quality Through Combined Question Answering Datasets","Knowledge Science, Engineering and Management","","","","10.1007/978-3-030-82147-0_16","Aleksandr PerevalovAndreas Both","2021","http://link.springer.com/chapter/10.1007/978-3-030-82147-0_16","Chapter"
"M-ATOLL: A Framework for the Lexicalization of Ontologies in Multiple Languages","The Semantic Web – ISWC 2014","","","","10.1007/978-3-319-11964-9_30","Sebastian WalterChristina UngerPhilipp Cimiano","2014","http://link.springer.com/chapter/10.1007/978-3-319-11964-9_30","Chapter"
"Meet the Data","Entity-Oriented Search","","","","10.1007/978-3-319-93935-3_2","Krisztian Balog","2018","http://link.springer.com/chapter/10.1007/978-3-319-93935-3_2","Chapter"
"Qanary – A Methodology for Vocabulary-Driven Open Question Answering Systems","The Semantic Web. Latest Advances and New Domains","","","","10.1007/978-3-319-34129-3_38","Andreas BothDennis DiefenbachKuldeep SinghSaedeeh ShekarpourDidier CherixChristoph Lange","2016","http://link.springer.com/chapter/10.1007/978-3-319-34129-3_38","Chapter"
"Handling Modifiers in Question Answering over Knowledge Graphs","AI*IA 2019 – Advances in Artificial Intelligence","","","","10.1007/978-3-030-35166-3_15","Lucia SicilianiDennis DiefenbachPierre MaretPierpaolo BasilePasquale Lops","2019","http://link.springer.com/chapter/10.1007/978-3-030-35166-3_15","Chapter"
"Results and Lessons of the Question Answering Track at CLEF","Information Retrieval Evaluation in a Changing World","","","","10.1007/978-3-030-22948-1_18","Anselmo PeñasÁlvaro RodrigoBernardo MagniniPamela FornerEduard HovyRichard SutcliffeDanilo Giampiccolo","2019","http://link.springer.com/chapter/10.1007/978-3-030-22948-1_18","Chapter"
"From the Web of Documents to the Linked Data","Business Intelligence","","","","10.1007/978-3-319-17551-5_3","Gabriel KépéklianOlivier CuréLaurent Bihanic","2015","http://link.springer.com/chapter/10.1007/978-3-319-17551-5_3","Chapter"
"Ask Like an Egyptian: Question Answering in the Alexandria Use Case","Towards the Internet of Services: The THESEUS Research Program","","","","10.1007/978-3-319-06755-1_23","Matthias WendtMartin GerlachHolger Düwiger","2014","http://link.springer.com/chapter/10.1007/978-3-319-06755-1_23","Chapter"
"The Qanary Ecosystem: Getting New Insights by Composing Question Answering Pipelines","Web Engineering","","","","10.1007/978-3-319-60131-1_10","Dennis DiefenbachKuldeep SinghAndreas BothDidier CherixChristoph LangeSören Auer","2017","http://link.springer.com/chapter/10.1007/978-3-319-60131-1_10","Chapter"
"“Talking” Triples to Museum Chatbots","Culture and Computing","","","","10.1007/978-3-030-50267-6_22","Savvas VaritimiadisKonstantinos KotisDimitris SpiliotopoulosCostas VassilakisDionisis Margaris","2020","http://link.springer.com/chapter/10.1007/978-3-030-50267-6_22","Chapter"
"Deep Learning in Question Answering","Deep Learning in Natural Language Processing","","","","10.1007/978-981-10-5209-5_7","Kang LiuYansong Feng","2018","http://link.springer.com/chapter/10.1007/978-981-10-5209-5_7","Chapter"
"Learning a Cross-Lingual Semantic Representation of Relations Expressed in Text","The Semantic Web. Latest Advances and New Domains","","","","10.1007/978-3-319-18818-8_21","Achim RettingerArtem SchumilinSteffen ThomaBasil Ell","2015","http://link.springer.com/chapter/10.1007/978-3-319-18818-8_21","Chapter"
"From RDF to Natural Language and Back","Towards the Multilingual Semantic Web","","","","10.1007/978-3-662-43585-4_12","Daniel GerberAxel-Cyrille Ngonga Ngomo","2014","http://link.springer.com/chapter/10.1007/978-3-662-43585-4_12","Chapter"
"Language Resources and Linked Data: A Practical Perspective","Knowledge Engineering and Knowledge Management","","","","10.1007/978-3-319-17966-7_1","Jorge GraciaDaniel Vila-SueroJohn P. McCraeTiziano FlatiCiro BaronMilan Dojchinovski","2015","http://link.springer.com/chapter/10.1007/978-3-319-17966-7_1","Chapter"
"Data Integration for Open Data on the Web","Reasoning Web. Semantic Interoperability on the Web","","","","10.1007/978-3-319-61033-7_1","Sebastian NeumaierAxel PolleresSimon SteyskalJürgen Umbrich","2017","http://link.springer.com/chapter/10.1007/978-3-319-61033-7_1","Chapter"
"Ecosystems","Domain-Specific Knowledge Graph Construction","","","","10.1007/978-3-030-12375-8_5","Mayank Kejriwal","2019","http://link.springer.com/chapter/10.1007/978-3-030-12375-8_5","Chapter"
"Swip: A Natural Language to SPARQL Interface Implemented with SPARQL","Graph-Based Representation and Reasoning","","","","10.1007/978-3-319-08389-6_21","Camille PradelOllivier HaemmerléNathalie Hernandez","2014","http://link.springer.com/chapter/10.1007/978-3-319-08389-6_21","Chapter"
"Modelling and Factorizing Large-Scale Knowledge Graph (DBPedia) for Fine-Grained Entity Type Inference","Databases Theory and Applications","","","","10.1007/978-3-030-69377-0_17","A. B. M. Moniruzzaman","2021","http://link.springer.com/chapter/10.1007/978-3-030-69377-0_17","Chapter"
"Knowledge Graphs","Artificial Intelligence","","","","10.1007/978-3-030-72357-6_12","Charu C. Aggarwal","2021","http://link.springer.com/chapter/10.1007/978-3-030-72357-6_12","Chapter"
"A Language Adaptive Method for Question Answering on French and English","Semantic Web Challenges","","","","10.1007/978-3-030-00072-1_9","Nikolay RadoevAmal ZouaqMathieu TremblayMichel Gagnon","2018","http://link.springer.com/chapter/10.1007/978-3-030-00072-1_9","Chapter"
"Frankenstein: A Platform Enabling Reuse of Question Answering Components","The Semantic Web","","","","10.1007/978-3-319-93417-4_40","Kuldeep SinghAndreas BothArun SethupatSaeedeh Shekarpour","2018","http://link.springer.com/chapter/10.1007/978-3-319-93417-4_40","Chapter"
"CASQAD – A New Dataset for Context-Aware Spatial Question Answering","The Semantic Web – ISWC 2020","","","","10.1007/978-3-030-62466-8_1","Jewgeni RoseJens Lehmann","2020","http://link.springer.com/chapter/10.1007/978-3-030-62466-8_1","Chapter"
"A Quantitative Evaluation of Natural Language Question Interpretation for Question Answering Systems","Semantic Technology","","","","10.1007/978-3-030-04284-4_15","Takuto AsakuraJin-Dong KimYasunori YamamotoYuka TateisiToshihisa Takagi","2018","http://link.springer.com/chapter/10.1007/978-3-030-04284-4_15","Chapter"
"Overview of the CLEF Question Answering Track 2015","Experimental IR Meets Multilinguality, Multimodality, and Interaction","","","","10.1007/978-3-319-24027-5_50","Anselmo PeñasChristina UngerGeorgios PaliourasIoannis Kakadiaris","2015","http://link.springer.com/chapter/10.1007/978-3-319-24027-5_50","Chapter"
"YAGO: A Multilingual Knowledge Base from Wikipedia, Wordnet, and Geonames","The Semantic Web – ISWC 2016","","","","10.1007/978-3-319-46547-0_19","Thomas RebeleFabian SuchanekJohannes HoffartJoanna BiegaErdal KuzeyGerhard Weikum","2016","http://link.springer.com/chapter/10.1007/978-3-319-46547-0_19","Chapter"
"WDAqua-core0: A Question Answering Component for the Research Community","Semantic Web Challenges","","","","10.1007/978-3-319-69146-6_8","Dennis DiefenbachKamal SinghPierre Maret","2017","http://link.springer.com/chapter/10.1007/978-3-319-69146-6_8","Chapter"
"Term-Based Models for Entity Ranking","Entity-Oriented Search","","","","10.1007/978-3-319-93935-3_3","Krisztian Balog","2018","http://link.springer.com/chapter/10.1007/978-3-319-93935-3_3","Chapter"
"Enabling Efficient Question Answering over Hundreds of Linked Datasets","Information Search, Integration, and Personalization","","","","10.1007/978-3-030-44900-1_1","Eleftherios DimitrakisKonstantinos SgontzosMichalis MountantonakisYannis Tzitzikas","2020","http://link.springer.com/chapter/10.1007/978-3-030-44900-1_1","Chapter"
"A Recommender System for Linked Data","Semantic Search over the Web","","","","10.1007/978-3-642-25008-8_12","Roberto MirizziTommaso Di NoiaEugenio Di SciascioAzzurra Ragone","2012","http://link.springer.com/chapter/10.1007/978-3-642-25008-8_12","Chapter"
"Linked Data Services and Semantics-Enabled Mashup","Semantic Search over the Web","","","","10.1007/978-3-642-25008-8_11","Devis BianchiniValeria De Antonellis","2012","http://link.springer.com/chapter/10.1007/978-3-642-25008-8_11","Chapter"
"A Distributional Semantic Search Infrastructure for Linked Dataspaces","The Semantic Web: ESWC 2013 Satellite Events","","","","10.1007/978-3-642-41242-4_27","André FreitasSeán O’RiainEdward Curry","2013","http://link.springer.com/chapter/10.1007/978-3-642-41242-4_27","Chapter"
"Missing RDF Triples Detection and Correction in Knowledge Graphs","Semantic Technology","","","","10.1007/978-3-319-70682-5_11","Lihua ZhaoRumana Ferdous MunneNatthawut KertkeidkachornRyutaro Ichise","2017","http://link.springer.com/chapter/10.1007/978-3-319-70682-5_11","Chapter"
"LODifier: Generating Linked Data from Unstructured Text","The Semantic Web: Research and Applications","","","","10.1007/978-3-642-30284-8_21","Isabelle AugensteinSebastian PadóSebastian Rudolph","2012","http://link.springer.com/chapter/10.1007/978-3-642-30284-8_21","Chapter"
"Querying","Mastering Structured Data on the Semantic Web","","","","10.1007/978-1-4842-1049-9_7","Leslie F. Sikos Ph.D.","2015","http://link.springer.com/chapter/10.1007/978-1-4842-1049-9_7","Chapter"
"THOTH: Neural Translation and Enrichment of Knowledge Graphs","The Semantic Web – ISWC 2019","","","","10.1007/978-3-030-30793-6_29","Diego MoussallemTommaso SoruAxel-Cyrille Ngonga Ngomo","2019","http://link.springer.com/chapter/10.1007/978-3-030-30793-6_29","Chapter"
"The Joy of Data - A Cookbook for Publishing Linked Government Data on the Web","Linking Government Data","","","","10.1007/978-1-4614-1767-5_1","Bernadette HylandDavid Wood","2011","http://link.springer.com/chapter/10.1007/978-1-4614-1767-5_1","Chapter"
"DBpedia Mashups","Semantic Mashups","","","","10.1007/978-3-642-36403-7_4","Mihály HéderIllés Solt","2013","http://link.springer.com/chapter/10.1007/978-3-642-36403-7_4","Chapter"
"Demoing Platypus – A Multilingual Question Answering Platform for Wikidata","The Semantic Web: ESWC 2018 Satellite Events","","","","10.1007/978-3-319-98192-5_21","Thomas Pellissier TanonMarcos Dias de AssunçãoEddy CaronFabian M. Suchanek","2018","http://link.springer.com/chapter/10.1007/978-3-319-98192-5_21","Chapter"
"Interlinking Cross-Lingual RDF Data Sets","The Semantic Web: Semantics and Big Data","","","","10.1007/978-3-642-38288-8_49","Tatiana Lesnikova","2013","http://link.springer.com/chapter/10.1007/978-3-642-38288-8_49","Chapter"
"Explicable Question Answering","The Semantic Web: ESWC 2020 Satellite Events","","","","10.1007/978-3-030-62327-2_41","Endri Kacupaj","2020","http://link.springer.com/chapter/10.1007/978-3-030-62327-2_41","Chapter"
"Towards Multilingual Neural Question Answering","New Trends in Databases and Information Systems","","","","10.1007/978-3-030-00063-9_26","Ekaterina LoginovaStalin VaranasiGünter Neumann","2018","http://link.springer.com/chapter/10.1007/978-3-030-00063-9_26","Chapter"
"Zhishi.me - Weaving Chinese Linking Open Data","The Semantic Web – ISWC 2011","","","","10.1007/978-3-642-25093-4_14","Xing NiuXinruo SunHaofen WangShu RongGuilin QiYong Yu","2011","http://link.springer.com/chapter/10.1007/978-3-642-25093-4_14","Chapter"
"GQA: Grammatical Question Answering for RDF Data","Semantic Web Challenges","","","","10.1007/978-3-030-00072-1_8","Elizaveta ZiminaJyrki NummenmaaKalervo JärvelinJaakko PeltonenKostas StefanidisHeikki Hyyrö","2018","http://link.springer.com/chapter/10.1007/978-3-030-00072-1_8","Chapter"
"Extending the YAGO2 Knowledge Graph with Precise Geospatial Knowledge","The Semantic Web – ISWC 2019","","","","10.1007/978-3-030-30796-7_12","Nikolaos KaralisGeorgios MandilarasManolis Koubarakis","2019","http://link.springer.com/chapter/10.1007/978-3-030-30796-7_12","Chapter"
"Supporting the Linked Data Life Cycle Using an Integrated Tool Stack","Linked Open Data -- Creating Knowledge Out of Interlinked Data","","","","10.1007/978-3-319-09846-3_6","Bert Van NuffelenValentina JanevMichael MartinVuk MijovicSebastian Tramp","2014","http://link.springer.com/chapter/10.1007/978-3-319-09846-3_6","Chapter"
"QueDI: From Knowledge Graph Querying to Data Visualization","Semantic Systems. In the Era of Knowledge Graphs","","","","10.1007/978-3-030-59833-4_5","Renato De DonatoMartina GarofaloDelfina MalandrinoMaria Angela PellegrinoAndrea PettaVittorio Scarano","2020","http://link.springer.com/chapter/10.1007/978-3-030-59833-4_5","Chapter"
"A Corpus-Based Approach for the Induction of Ontology Lexica","Natural Language Processing and Information Systems","","","","10.1007/978-3-642-38824-8_9","Sebastian WalterChristina UngerPhilipp Cimiano","2013","http://link.springer.com/chapter/10.1007/978-3-642-38824-8_9","Chapter"
"Overview of CLEF Question Answering Track 2014","Information Access Evaluation. Multilinguality, Multimodality, and Interaction","","","","10.1007/978-3-319-11382-1_23","Anselmo PeñasChristina UngerAxel-Cyrille Ngonga Ngomo","2014","http://link.springer.com/chapter/10.1007/978-3-319-11382-1_23","Chapter"
"Knowledge Graphs and Natural-Language Processing","Big Data in Emergency Management: Exploitation Techniques for Social and Mobile Data","","","","10.1007/978-3-030-48099-8_4","Andreas L. Opdahl","2020","http://link.springer.com/chapter/10.1007/978-3-030-48099-8_4","Chapter"
"Extracting Multilingual Natural-Language Patterns for RDF Predicates","Knowledge Engineering and Knowledge Management","","","","10.1007/978-3-642-33876-2_10","Daniel GerberAxel-Cyrille Ngonga Ngomo","2012","http://link.springer.com/chapter/10.1007/978-3-642-33876-2_10","Chapter"
"Knowledge Graphs and Bases","A Knowledge Representation Practionary","","","","10.1007/978-3-319-98092-8_11","Michael K. Bergman","2018","http://link.springer.com/chapter/10.1007/978-3-319-98092-8_11","Chapter"
"AskNow: A Framework for Natural Language Query Formalization in SPARQL","The Semantic Web. Latest Advances and New Domains","","","","10.1007/978-3-319-34129-3_19","Mohnish DubeySourish DasguptaAnkit SharmaKonrad HöffnerJens Lehmann","2016","http://link.springer.com/chapter/10.1007/978-3-319-34129-3_19","Chapter"
"Exploratory Professional Search through Semantic Post-Analysis of Search Results","Professional Search in the Modern World","","","","10.1007/978-3-319-12511-4_9","Pavlos FafaliosYannis Tzitzikas","2014","http://link.springer.com/chapter/10.1007/978-3-319-12511-4_9","Chapter"
"Medical Semantic Question Answering Framework on RDF Data Cubes","Enhanced Quality of Life and Smart Living","","","","10.1007/978-3-319-66188-9_23","Usman AkhtarJamil HussainSungyoung Lee","2017","http://link.springer.com/chapter/10.1007/978-3-319-66188-9_23","Chapter"
"KnowlyBERT - Hybrid Query Answering over Language Models and Knowledge Graphs","The Semantic Web – ISWC 2020","","","","10.1007/978-3-030-62419-4_17","Jan-Christoph KaloLeandra FichtelPhilipp EhlerWolf-Tilo Balke","2020","http://link.springer.com/chapter/10.1007/978-3-030-62419-4_17","Chapter"
