Item Title,Publication Title,Book Series Title,Journal Volume,Journal Issue,Item DOI,Authors,Publication Year,URL,Content Type
"Comparative Evaluation of Community Question Answering Websites","The Outreach of Digital Libraries: A Globalized Resource Network","","","","10.1007/978-3-642-34752-8_27","Alton Y. K. ChuaRadhika Shenoy Balkunje","2012","http://link.springer.com/chapter/10.1007/978-3-642-34752-8_27","Chapter"
"An Effective Deep Transfer Learning and Information Fusion Framework for Medical Visual Question Answering","Experimental IR Meets Multilinguality, Multimodality, and Interaction","","","","10.1007/978-3-030-28577-7_20","Feifan LiuYalei PengMax P. Rosen","2019","http://link.springer.com/chapter/10.1007/978-3-030-28577-7_20","Chapter"
"An Adversarial Joint Learning Model for Low-Resource Language Semantic Textual Similarity","Advances in Information Retrieval","","","","10.1007/978-3-319-76941-7_7","Junfeng TianMan LanYuanbin WuJingang WangLong QiuSheng LiLang JunLuo Si","2018","http://link.springer.com/chapter/10.1007/978-3-319-76941-7_7","Chapter"
"Implementation of Smart Legal Assistance System in Accordance with the Indian Penal Code Using Similarity Measures","Advances in Computing and Data Sciences","","","","10.1007/978-981-13-9942-8_42","Dipti PawadeAvani SakhaparaHussain RatlamwalaSiddharth MishraSamreen ShaikhDhrumil Mehta","2019","http://link.springer.com/chapter/10.1007/978-981-13-9942-8_42","Chapter"
"Language Technology Support for Dutch","The Dutch Language in the Digital Age","","","","10.1007/978-3-642-25978-4_9","Georg RehmHans Uszkoreit","2012","http://link.springer.com/chapter/10.1007/978-3-642-25978-4_9","Chapter"
"Understanding and Exploiting User’s Navigational Intent in Community Question Answering","Information Retrieval Technology","","","","10.1007/978-3-642-45068-6_34","Long ChenDell ZhangMark Levene","2013","http://link.springer.com/chapter/10.1007/978-3-642-45068-6_34","Chapter"
"Natural Language Processing Basics","Text Analytics with Python","","","","10.1007/978-1-4842-4354-1_1","Dipanjan Sarkar","2019","http://link.springer.com/chapter/10.1007/978-1-4842-4354-1_1","Chapter"
"Pre-trained Language Models for Tagalog with Multi-source Data","Natural Language Processing and Chinese Computing","","","","10.1007/978-3-030-88480-2_17","Shengyi JiangYingwen FuXiaotian LinNankai Lin","2021","http://link.springer.com/chapter/10.1007/978-3-030-88480-2_17","Chapter"
"An Overview of Language Processing","Language Processing with Perl and Prolog","","","","10.1007/978-3-642-41464-0_1","Pierre M. Nugues","2014","http://link.springer.com/chapter/10.1007/978-3-642-41464-0_1","Chapter"
"Conclusions and Future Directions","Entity-Oriented Search","","","","10.1007/978-3-319-93935-3_10","Krisztian Balog","2018","http://link.springer.com/chapter/10.1007/978-3-319-93935-3_10","Chapter"
"Language Technology Support for Spanish","The Spanish Language in the Digital Age","","","","10.1007/978-3-642-30841-3_9","Georg RehmHans Uszkoreit","2012","http://link.springer.com/chapter/10.1007/978-3-642-30841-3_9","Chapter"
"Operational Engines","Handbook of Natural Language Processing and Machine Translation","","","","10.1007/978-1-4419-7713-7_6","Douglas W. OardCarl MadsonJoseph OliveJohn McCaryCaitlin Christianson","2011","http://link.springer.com/chapter/10.1007/978-1-4419-7713-7_6","Chapter"
"Language Technology Support for Basque","The Basque Language in the Digital Age","","","","10.1007/978-3-642-30796-6_9","Inmaculada HernáezEva NavasIgor OdriozolaKepa SarasolaArantza Diaz de IlarrazaIgor LeturiaAraceli Diaz de LezanaBeñat OihartzabalJasone Salaberria","2012","http://link.springer.com/chapter/10.1007/978-3-642-30796-6_9","Chapter"
"Language Technology Support for Finnish","The Finnish Language in the Digital Age","","","","10.1007/978-3-642-27248-6_9","Georg RehmHans Uszkoreit","2012","http://link.springer.com/chapter/10.1007/978-3-642-27248-6_9","Chapter"
"Neural Article Pair Modeling for Wikipedia Sub-article Matching","Machine Learning and Knowledge Discovery in Databases","","","","10.1007/978-3-030-10997-4_1","Muhao ChenChangping MengGang HuangCarlo Zaniolo","2019","http://link.springer.com/chapter/10.1007/978-3-030-10997-4_1","Chapter"
"The Scholarly Impact and Strategic Intent of CLEF eHealth Labs from 2012 to 2017","Information Retrieval Evaluation in a Changing World","","","","10.1007/978-3-030-22948-1_14","Hanna SuominenLiadh KellyLorraine Goeuriot","2019","http://link.springer.com/chapter/10.1007/978-3-030-22948-1_14","Chapter"
"Boosting Retrieval of Digital Spoken Content","Knowledge Engineering, Machine Learning and Lattice Computing with Applications","","","","10.1007/978-3-642-37343-5_16","Bernardo Pereira NunesAlexander MeraMarco A. CasanovaRicardo Kawase","2013","http://link.springer.com/chapter/10.1007/978-3-642-37343-5_16","Chapter"
"Language Technology Support for Latvian","The Latvian Language in the Digital Age","","","","10.1007/978-3-642-30876-5_9","Inguna SkadiņaAndrejs VeisbergsAndrejs VasiļjevsTatjana GornostajaIveta KeišaAlda Rudzīte","2012","http://link.springer.com/chapter/10.1007/978-3-642-30876-5_9","Chapter"
"Linguistic Patterns for Encyclopaedic Information Extraction","Flexible Query Answering Systems","","","","10.1007/978-3-642-40769-7_57","Jesús CardeñosaMiguel Ángel de la VillaCarolina Gallardo","2013","http://link.springer.com/chapter/10.1007/978-3-642-40769-7_57","Chapter"
"Semantic Rule Filtering for Web-Scale Relation Extraction","The Semantic Web – ISWC 2013","","","","10.1007/978-3-642-41335-3_22","Andrea MoroHong LiSebastian KrauseFeiyu XuRoberto NavigliHans Uszkoreit","2013","http://link.springer.com/chapter/10.1007/978-3-642-41335-3_22","Chapter"
"Language Technology Support for Danish","The Danish Language in the Digital Age","","","","10.1007/978-3-642-30627-3_9","Georg RehmHans Uszkoreit","2012","http://link.springer.com/chapter/10.1007/978-3-642-30627-3_9","Chapter"
"Ensemble Approach for Cross Language Information Retrieval","Computational Linguistics and Intelligent Text Processing","","","","10.1007/978-3-642-28601-8_23","Dinesh MavaluruR. ShriramW. Aisha Banu","2012","http://link.springer.com/chapter/10.1007/978-3-642-28601-8_23","Chapter"
"Language Technology Support for Estonian","The Estonian Language in the Digital Age","","","","10.1007/978-3-642-30785-0_9","Georg RehmHans Uszkoreit","2012","http://link.springer.com/chapter/10.1007/978-3-642-30785-0_9","Chapter"
"A Framework of Data Fusion Through Spatio-Temporal Knowledge Graph","Knowledge Science, Engineering and Management","","","","10.1007/978-3-030-82136-4_18","Xiaohan ZhangXinning ZhuJie WuZheng HuChunhong Zhang","2021","http://link.springer.com/chapter/10.1007/978-3-030-82136-4_18","Chapter"
"LiCord: Language Independent Content Word Finder","Hybrid Artificial Intelligent Systems","","","","10.1007/978-3-319-32034-2_4","Md-Mizanur RahomanTetsuya NasukawaHiroshi KanayamaRyutaro Ichise","2016","http://link.springer.com/chapter/10.1007/978-3-319-32034-2_4","Chapter"
"Dialog Modelling Experiments with Finnish One-to-One Chat Data","Artificial Intelligence and Natural Language","","","","10.1007/978-3-030-59082-6_3","Janne KauttonenLili Aunimo","2020","http://link.springer.com/chapter/10.1007/978-3-030-59082-6_3","Chapter"
"Modeling the International Classification of Diseases (ICD-10) in OWL","Knowledge Discovery, Knowledge Engineering and Knowledge Management","","","","10.1007/978-3-642-29764-9_16","Manuel MöllerDaniel SonntagPatrick Ernst","2013","http://link.springer.com/chapter/10.1007/978-3-642-29764-9_16","Chapter"
"GALLURA and the Challenge of Combining Phono-Semantic Matching with Story-Generation: Zoonomastic Illustration","Language, Culture, Computation. Computational Linguistics and Linguistics","","","","10.1007/978-3-642-45327-4_19","Ephraim NissanYaakov HaCohen-Kerner","2014","http://link.springer.com/chapter/10.1007/978-3-642-45327-4_19","Chapter"
"A Short Review on Deep Learning for Entity Recognition","Future Data and Security Engineering","","","","10.1007/978-3-030-03192-3_20","Hien T. NguyenThuan Quoc Nguyen","2018","http://link.springer.com/chapter/10.1007/978-3-030-03192-3_20","Chapter"
"Language Technology Support for Galician","The Galician Language in the Digital Age","","","","10.1007/978-3-642-30799-7_9","Carmen García MateoMontserrat Arza Rodríguez","2012","http://link.springer.com/chapter/10.1007/978-3-642-30799-7_9","Chapter"
"Natural Language Basics","Text Analytics with Python","","","","10.1007/978-1-4842-2388-8_1","Dipanjan Sarkar","2016","http://link.springer.com/chapter/10.1007/978-1-4842-2388-8_1","Chapter"
"The VoiceApp System: Speech Technologies to Access the Semantic Web","Advances in Artificial Intelligence","","","","10.1007/978-3-642-25274-7_40","David GriolJosé Manuel MolinaVíctor Corrales","2011","http://link.springer.com/chapter/10.1007/978-3-642-25274-7_40","Chapter"
"Learning Multi-granular Features for Harvesting Knowledge from Free Text","Rough Sets","","","","10.1007/978-3-030-22815-6_17","Zheng ZhouHuaming WangZhixing LiFeng HuGuoyin Wang","2019","http://link.springer.com/chapter/10.1007/978-3-030-22815-6_17","Chapter"
"Ontology-Based Geospatial Approaches for Semantic Awareness in Earth Observation Systems","Geospatial Semantics and the Semantic Web","","","","10.1007/978-1-4419-9446-2_5","Kristin StockGobe HobonaCarlos GranellMike Jackson","2011","http://link.springer.com/chapter/10.1007/978-1-4419-9446-2_5","Chapter"
"Large-Scale Learning of Relation-Extraction Rules with Distant Supervision from the Web","The Semantic Web – ISWC 2012","","","","10.1007/978-3-642-35176-1_17","Sebastian KrauseHong LiHans UszkoreitFeiyu Xu","2012","http://link.springer.com/chapter/10.1007/978-3-642-35176-1_17","Chapter"
"Towards a Semantic Search Engine for Scientific Articles","Research and Advanced Technology for Digital Libraries","","","","10.1007/978-3-319-67008-9_54","Bastien LatardJonathan WeberGermain ForestierMichel Hassenforder","2017","http://link.springer.com/chapter/10.1007/978-3-319-67008-9_54","Chapter"
"Residual Connection-Based Multi-step Reasoning via Commonsense Knowledge for Multiple Choice Machine Reading Comprehension","Neural Information Processing","","","","10.1007/978-3-030-36718-3_29","Yixuan ShengMan Lan","2019","http://link.springer.com/chapter/10.1007/978-3-030-36718-3_29","Chapter"
"Contributions from ADBIS 2018 Workshops","New Trends in Databases and Information Systems","","","","10.1007/978-3-030-00063-9_11","Udo BubAjantha DahanayakeJérôme DarmontClaudia DiamantiniFabio FassettiEduardo FerméNadia KabachiIlaria MatteucciBálint MolnárSham NavatheErmelinda OroMarinella PetrocchiSimona E. RomboMassimo RuffoloAngelo SpognardiBernhard Thalheim","2018","http://link.springer.com/chapter/10.1007/978-3-030-00063-9_11","Chapter"
"Adaptive Algorithm for Interactive Question-Based Search","Intelligent Information Processing VI","","","","10.1007/978-3-642-32891-6_24","Jacek RzeniewiczJulian SzymańskiWłodzisław Duch","2012","http://link.springer.com/chapter/10.1007/978-3-642-32891-6_24","Chapter"
"The GIL Summarizers: Experiments in the Track QA@INEX’10","Comparative Evaluation of Focused Retrieval","","","","10.1007/978-3-642-23577-1_25","Edmundo-Pavel Soriano-MoralesAlfonso Medina-UrreaGerardo Sierra MartínezCarlos-Francisco Méndez-Cruz","2011","http://link.springer.com/chapter/10.1007/978-3-642-23577-1_25","Chapter"
"A Formal Model for Constructing Semantic Expansions of the Search Requests about the Achievements and Failures","Artificial Intelligence: Methodology, Systems, and Applications","","","","10.1007/978-3-642-33185-5_33","Vladimir A. FomichovAnton V. Kirillov","2012","http://link.springer.com/chapter/10.1007/978-3-642-33185-5_33","Chapter"
"A Novel Machine Translation Method for Learning Chinese as a Foreign Language","Computational Linguistics and Intelligent Text Processing","","","","10.1007/978-3-642-54903-8_29","Tiansi DongArmin B. Cremers","2014","http://link.springer.com/chapter/10.1007/978-3-642-54903-8_29","Chapter"
"Language Technology Support for Czech","The Czech Language in the Digital Age","","","","10.1007/978-3-642-30706-5_9","Georg RehmHans Uszkoreit","2012","http://link.springer.com/chapter/10.1007/978-3-642-30706-5_9","Chapter"
"Role of Paraphrases in PB-SMT","Computational Linguistics and Intelligent Text Processing","","","","10.1007/978-3-642-54903-8_21","Santanu PalPintu LoharSudip Kumar Naskar","2014","http://link.springer.com/chapter/10.1007/978-3-642-54903-8_21","Chapter"
"Knowledge Living on the Web (KLW)","New Challenges on Bioinspired Applications","","","","10.1007/978-3-642-21326-7_42","Miguel A. FernandezJuan Miguel RuizOlvido Arraez JarqueMargarita Carrion Varela","2011","http://link.springer.com/chapter/10.1007/978-3-642-21326-7_42","Chapter"
"Semantic Interoperability of Multilingual Language Resources by Automatic Mapping","Electronic Government and the Information Systems Perspective","","","","10.1007/978-3-319-98349-3_12","P. SchmitzE. FrancesconiN. HajlaouiB. BatoucheA. Stellato","2018","http://link.springer.com/chapter/10.1007/978-3-319-98349-3_12","Chapter"
"Improving Named Entity Recognition with Commonsense Knowledge Pre-training","Knowledge Management and Acquisition for Intelligent Systems","","","","10.1007/978-3-030-30639-7_2","Ghaith DekhiliNgoc Tan LeFatiha Sadat","2019","http://link.springer.com/chapter/10.1007/978-3-030-30639-7_2","Chapter"
"Information Retrieval","Fundamentals of Artificial Intelligence","","","","10.1007/978-81-322-3972-7_18","K. R. Chowdhary","2020","http://link.springer.com/chapter/10.1007/978-81-322-3972-7_18","Chapter"
"A Rule-Based Morphosemantic Analyzer for French for a Fine-Grained Semantic Annotation of Texts","Systems and Frameworks for Computational Morphology","","","","10.1007/978-3-642-40486-3_6","Fiammetta Namer","2013","http://link.springer.com/chapter/10.1007/978-3-642-40486-3_6","Chapter"
"Introduction","Natural Language Understanding in a Semantic Web Context","","","","10.1007/978-3-319-41337-2_1","Caroline Barrière","2016","http://link.springer.com/chapter/10.1007/978-3-319-41337-2_1","Chapter"
"GeoEtypes: Harmonizing Diversity in Geospatial Data (Short Paper)","On the Move to Meaningful Internet Systems: OTM 2016 Conferences","","","","10.1007/978-3-319-48472-3_38","Subhashis DasFausto Giunchiglia","2016","http://link.springer.com/chapter/10.1007/978-3-319-48472-3_38","Chapter"
"Translating between Language and Logic: What Is Easy and What Is Difficult","Automated Deduction – CADE-23","","","","10.1007/978-3-642-22438-6_3","Aarne Ranta","2011","http://link.springer.com/chapter/10.1007/978-3-642-22438-6_3","Chapter"
"Introduction","Structure Discovery in Natural Language","","","","10.1007/978-3-642-25923-4_1","Chris Biemann","2012","http://link.springer.com/chapter/10.1007/978-3-642-25923-4_1","Chapter"
"The Language Application Grid Web Service Exchange Vocabulary","Worldwide Language Service Infrastructure","","","","10.1007/978-3-319-31468-6_2","Nancy IdeKeith SudermanMarc VerhagenJames Pustejovsky","2016","http://link.springer.com/chapter/10.1007/978-3-319-31468-6_2","Chapter"
"Augmenting Embedding with Domain Knowledge for Oral Disease Diagnosis Prediction","Smart Computing and Communication","","","","10.1007/978-3-030-05755-8_24","Guangkai LiSongmao ZhangJie LiangZhanqiang CaoChuanbin Guo","2018","http://link.springer.com/chapter/10.1007/978-3-030-05755-8_24","Chapter"
"Semantic Product Description Language","The Internet of Products","","","","10.1007/978-3-658-00905-2_5","Robert Neumann","2013","http://link.springer.com/chapter/10.1007/978-3-658-00905-2_5","Chapter"
"Question-Response System Using the NooJ Linguistic Platform","Formalizing Natural Languages with NooJ and Its Natural Language Processing Applications","","","","10.1007/978-3-319-73420-0_16","Imen EnnasriSondes DardourHéla FehriKais Haddar","2018","http://link.springer.com/chapter/10.1007/978-3-319-73420-0_16","Chapter"
"VideoLecturesMashup: Using Media Fragments and Semantic Annotations to Enable Topic-Centred e-Learning","The Semantic Web: ESWC 2014 Satellite Events","","","","10.1007/978-3-319-11955-7_65","Lyndon NixonTanja ZdolsekAna FabjanPeter Kese","2014","http://link.springer.com/chapter/10.1007/978-3-319-11955-7_65","Chapter"
"Automatic Semantic Subject Indexing of Web Documents in Highly Inflected Languages","The Semantic Web: Research and Applications","","","","10.1007/978-3-642-21034-1_15","Reetta SinkkiläOsma SuominenEero Hyvönen","2011","http://link.springer.com/chapter/10.1007/978-3-642-21034-1_15","Chapter"
"Language Technology Support for Maltese","The Maltese Language in the Digital Age","","","","10.1007/978-3-642-30681-5_9","Mike RosnerJan Joachimsen","2012","http://link.springer.com/chapter/10.1007/978-3-642-30681-5_9","Chapter"
"Language Technology Support for Icelandic","The Icelandic Language in the Digital Age","","","","10.1007/978-3-642-30174-2_9","Georg RehmHans Uszkoreit","2012","http://link.springer.com/chapter/10.1007/978-3-642-30174-2_9","Chapter"
"Towards Multilingual Image Captioning Models that Can Read","Advances in Soft Computing","","","","10.1007/978-3-030-89820-5_2","Rafael Gallardo GarcíaBeatriz Beltrán MartínezCarlos Hernández GracidasDarnes Vilariño Ayala","2021","http://link.springer.com/chapter/10.1007/978-3-030-89820-5_2","Chapter"
"Internationalization","Web Standards","","","","10.1007/978-1-4842-0883-0_2","Leslie F. Sikos Ph.D.","2014","http://link.springer.com/chapter/10.1007/978-1-4842-0883-0_2","Chapter"
"Language Technology Support for Slovak","The Slovak Language in the Digital Age","","","","10.1007/978-3-642-30370-8_9","Georg RehmHans Uszkoreit","2012","http://link.springer.com/chapter/10.1007/978-3-642-30370-8_9","Chapter"
"An Empirical Study of Recognizing Textual Entailment in Japanese Text","Computational Linguistics and Intelligent Text Processing","","","","10.1007/978-3-642-28604-9_36","Quang Nhat Minh PhamLe Minh NguyenAkira Shimazu","2012","http://link.springer.com/chapter/10.1007/978-3-642-28604-9_36","Chapter"
"NLP in Virtual Assistants","Practical Natural Language Processing with Python","","","","10.1007/978-1-4842-6246-7_5","Mathangi Sri","2021","http://link.springer.com/chapter/10.1007/978-1-4842-6246-7_5","Chapter"
"Towards the Development of the Multilingual Multimodal Virtual Agent","Advances in Natural Language Processing","","","","10.1007/978-3-319-10888-9_46","Inese VīraJānis TeseļskisInguna Skadiņa","2014","http://link.springer.com/chapter/10.1007/978-3-319-10888-9_46","Chapter"
"Background Taxonomy Matching","Taxonomy Matching Using Background Knowledge","","","","10.1007/978-3-319-72209-2_1","Heiko AngermannNaeem Ramzan","2017","http://link.springer.com/chapter/10.1007/978-3-319-72209-2_1","Chapter"
"Legal Question Answering System Using FrameNet","New Frontiers in Artificial Intelligence","","","","10.1007/978-3-030-31605-1_15","Ryosuke TaniguchiReina HoshinoYoshinobu Kano","2019","http://link.springer.com/chapter/10.1007/978-3-030-31605-1_15","Chapter"
"Legal Yes/No Question Answering System Using Case-Role Analysis","New Frontiers in Artificial Intelligence","","","","10.1007/978-3-319-61572-1_19","Ryosuke TaniguchiYoshinobu Kano","2017","http://link.springer.com/chapter/10.1007/978-3-319-61572-1_19","Chapter"
"ezDL: An Interactive IR Framework, Search Tool, and Evaluation System","Professional Search in the Modern World","","","","10.1007/978-3-319-12511-4_7","Thomas BeckersSebastian DungsNorbert FuhrMatthias JordanGeorgios KontokotsiosSascha KriewelYiannis ParaskeuopoulosMichail Salampasis","2014","http://link.springer.com/chapter/10.1007/978-3-319-12511-4_7","Chapter"
"An Ontology Based Data Collection Service to Support eGov Service Design","Metadata and Semantics Research","","","","10.1007/978-3-642-35233-1_12","Muriel FoulonneauYounes Djaghloul","2012","http://link.springer.com/chapter/10.1007/978-3-642-35233-1_12","Chapter"
"Language Technology Support for Hungarian","The German Language in the Digital Age","","","","10.1007/978-3-642-27166-3_9","Georg RehmHans Uszkoreit","2012","http://link.springer.com/chapter/10.1007/978-3-642-27166-3_9","Chapter"
"A Question Answering Model Based on Semantic Matcher for Support Ticketing System","Advances in Computing and Data Sciences","","","","10.1007/978-981-13-1813-9_17","Suyog TrivediGopichand AgnihotramBalaji JaganPandurang Naik","2018","http://link.springer.com/chapter/10.1007/978-981-13-1813-9_17","Chapter"
"A Graph-Based Summarization System at QA@INEX Track 2011","Focused Retrieval of Content and Structure","","","","10.1007/978-3-642-35734-3_20","Ana Lilia Laureano-CrucesJavier Ramírez-Rodríguez","2012","http://link.springer.com/chapter/10.1007/978-3-642-35734-3_20","Chapter"
"Hybrid Algorithm for Multilingual Summarization of Hindi and Punjabi Documents","Mining Intelligence and Knowledge Exploration","","","","10.1007/978-3-319-03844-5_70","Vishal Gupta","2013","http://link.springer.com/chapter/10.1007/978-3-319-03844-5_70","Chapter"
"Machine Learning Meets Natural Language Processing - The Story so Far","Artificial Intelligence Applications and Innovations","","","","10.1007/978-3-030-79150-6_53","Nikolaos-Ioannis GalanisPanagiotis VafiadisKostas-Gkouram MirzaevGeorge A. Papakostas","2021","http://link.springer.com/chapter/10.1007/978-3-030-79150-6_53","Chapter"
"GEO-NASS: A Semantic Tagging Experience from Geographical Data on the Media","Advances in Databases and Information Systems","","","","10.1007/978-3-642-40683-6_5","Angel Luis GarridoMaria G. BueySergio IlarriEduardo Mena","2013","http://link.springer.com/chapter/10.1007/978-3-642-40683-6_5","Chapter"
"Using Concept-Level Random Walk Model and Global Inference Algorithm for Answer Summarization","Information Retrieval Technology","","","","10.1007/978-3-642-25631-8_39","Xiaoying LiuZhoujun LiXiaojian ZhaoZhenggan Zhou","2011","http://link.springer.com/chapter/10.1007/978-3-642-25631-8_39","Chapter"
"Recognizing Semantic Relations: Attention-Based Transformers vs. Recurrent Models","Advances in Information Retrieval","","","","10.1007/978-3-030-45439-5_37","Dmitri RoussinovSerge SharoffNadezhda Puchnina","2020","http://link.springer.com/chapter/10.1007/978-3-030-45439-5_37","Chapter"
"Network Representation","Representation Learning for Natural Language Processing","","","","10.1007/978-981-15-5573-2_8","Zhiyuan LiuYankai LinMaosong Sun","2020","http://link.springer.com/chapter/10.1007/978-981-15-5573-2_8","Chapter"
"Performance Analysis of Named Entity Recognition Approaches on Code-Mixed Data","Information, Communication and Computing Technology","","","","10.1007/978-3-030-88378-2_13","Sreeja GaddamidiRajendra Prasath","2021","http://link.springer.com/chapter/10.1007/978-3-030-88378-2_13","Chapter"
"Math-Bridge: Adaptive Platform for Multilingual Mathematics Courses","21st Century Learning for 21st Century Skills","","","","10.1007/978-3-642-33263-0_49","Sergey SosnovskyMichael DietrichEric AndrèsGeorge GoguadzeStefan Winterstein","2012","http://link.springer.com/chapter/10.1007/978-3-642-33263-0_49","Chapter"
"Experiential Knowledge in the Development of Decisional DNA (DDNA) and Decisional Trust for Global e-Decisional Community","Computational Collective Intelligence. Technologies and Applications","","","","10.1007/978-3-642-23935-9_2","Edward SzczerbickiCesar Sanin","2011","http://link.springer.com/chapter/10.1007/978-3-642-23935-9_2","Chapter"
"ExBERT: An External Knowledge Enhanced BERT for Natural Language Inference","Artificial Neural Networks and Machine Learning – ICANN 2021","","","","10.1007/978-3-030-86383-8_37","Amit GajbhiyeNoura Al MoubayedSteven Bradley","2021","http://link.springer.com/chapter/10.1007/978-3-030-86383-8_37","Chapter"
"RusNLP: Semantic Search Engine for Russian NLP Conference Papers","Analysis of Images, Social Networks and Texts","","","","10.1007/978-3-030-11027-7_11","Irina NikishinaAmir BakarovAndrey Kutuzov","2018","http://link.springer.com/chapter/10.1007/978-3-030-11027-7_11","Chapter"
"Language Technology Support for Portuguese","The Portuguese Language in the Digital Age","","","","10.1007/978-3-642-29593-5_9","Georg RehmHans Uszkoreit","2012","http://link.springer.com/chapter/10.1007/978-3-642-29593-5_9","Chapter"
"Advances in Deep Parsing of Scholarly Paper Content","Advanced Language Technologies for Digital Libraries","","","","10.1007/978-3-642-23160-5_9","Ulrich SchäferBernd Kiefer","2011","http://link.springer.com/chapter/10.1007/978-3-642-23160-5_9","Chapter"
"Comparing Contextual Embeddings for Semantic Textual Similarity in Portuguese","Intelligent Systems","","","","10.1007/978-3-030-91699-2_27","José E. Andrade JuniorJonathan Cardoso-SilvaLeonardo C. T. Bezerra","2021","http://link.springer.com/chapter/10.1007/978-3-030-91699-2_27","Chapter"
"A Data Model and Encoding for a Semantic, Multilingual Terminology of Mathematics","Intelligent Computer Mathematics","","","","10.1007/978-3-319-08434-3_13","Michael Kohlhase","2014","http://link.springer.com/chapter/10.1007/978-3-319-08434-3_13","Chapter"
"Federated Patent Search","Current Challenges in Patent Information Retrieval","","","","10.1007/978-3-662-53817-3_8","Michail Salampasis","2017","http://link.springer.com/chapter/10.1007/978-3-662-53817-3_8","Chapter"
"A Context-Aware Enterprise Search Engine for Aviation","Advanced Research in Applied Artificial Intelligence","","","","10.1007/978-3-642-31087-4_38","Hao WangQingwei LiuTangjian DengLing Feng","2012","http://link.springer.com/chapter/10.1007/978-3-642-31087-4_38","Chapter"
"Multilingual Dialogue Generation with Shared-Private Memory","Natural Language Processing and Chinese Computing","","","","10.1007/978-3-030-32233-5_4","Chen ChenLisong QiuZhenxin FuJunfei LiuRui Yan","2019","http://link.springer.com/chapter/10.1007/978-3-030-32233-5_4","Chapter"
