Item Title,Publication Title,Book Series Title,Journal Volume,Journal Issue,Item DOI,Authors,Publication Year,URL,Content Type
"Various Cognitive Platforms/Engines","Developing Cognitive Bots Using the IBM Watson Engine","","","","10.1007/978-1-4842-5555-1_2","Navin SabharwalSudipta BaruaNeha AnandPallavi Aggarwal","2020","http://link.springer.com/chapter/10.1007/978-1-4842-5555-1_2","Chapter"
"A Joint Introduction to Natural Language Processing and to Deep Learning","Deep Learning in Natural Language Processing","","","","10.1007/978-981-10-5209-5_1","Li DengYang Liu","2018","http://link.springer.com/chapter/10.1007/978-981-10-5209-5_1","Chapter"
"Methods of Linking Linguistic Resources for Semantic Role Labeling","Human Language Technology. Challenges for Computer Science and Linguistics","","","","10.1007/978-3-319-93782-3_14","Balázs IndigMárton MiháltzAndrás Simonyi","2018","http://link.springer.com/chapter/10.1007/978-3-319-93782-3_14","Chapter"
"Pre-training Polish Transformer-Based Language Models at Scale","Artificial Intelligence and Soft Computing","","","","10.1007/978-3-030-61534-5_27","Sławomir DadasMichał PerełkiewiczRafał Poświata","2020","http://link.springer.com/chapter/10.1007/978-3-030-61534-5_27","Chapter"
"Commonsense Reasoning Meets Theorem Proving","Multiagent System Technologies","","","","10.1007/978-3-319-45889-2_1","Ulrich FurbachClaudia Schon","2016","http://link.springer.com/chapter/10.1007/978-3-319-45889-2_1","Chapter"
"Evaluating Information Retrieval Systems on European Patent Data: The CLEF-IP Campaign","Current Challenges in Patent Information Retrieval","","","","10.1007/978-3-662-53817-3_4","Florina PiroiAllan Hanbury","2017","http://link.springer.com/chapter/10.1007/978-3-662-53817-3_4","Chapter"
"Internationalization","Web Standards","","","","10.1007/978-1-4302-4042-6_2","Leslie F. Sikos Ph.D.","2011","http://link.springer.com/chapter/10.1007/978-1-4302-4042-6_2","Chapter"
"Overview of the ImageCLEF 2020: Multimedia Retrieval in Medical, Lifelogging, Nature, and Internet Applications","Experimental IR Meets Multilinguality, Multimodality, and Interaction","","","","10.1007/978-3-030-58219-7_22","Bogdan IonescuHenning MüllerRenaud PéteriAsma Ben AbachaVivek DatlaSadid A. HasanDina Demner-FushmanSerge KozlovskiVitali LiauchukYashin Dicente CidVassili KovalevObioma PelkaChristoph M. FriedrichAlba García Seco de HerreraVan-Tu NinhTu-Khiem Le","2020","http://link.springer.com/chapter/10.1007/978-3-030-58219-7_22","Chapter"
"Entity Recognition and Linking in Chinese Search Queries","Natural Language Processing and Chinese Computing","","","","10.1007/978-3-319-25207-0_47","Jinwei YuanYan YangZhen JiaHongfeng YinJunfu HuangJie Zhu","2015","http://link.springer.com/chapter/10.1007/978-3-319-25207-0_47","Chapter"
"Leveraging Statistic and Semantic Features for Similar Question Detection Using Fusion XGBoost","Database Systems for Advanced Applications. DASFAA 2020 International Workshops","","","","10.1007/978-3-030-59413-8_9","Siyuan LiaoLeung-Pun WongLap-Kei LeeOliver AuTianyong Hao","2020","http://link.springer.com/chapter/10.1007/978-3-030-59413-8_9","Chapter"
"Overview of the ImageCLEF 2021: Multimedia Retrieval in Medical, Nature, Internet and Social Media Applications","Experimental IR Meets Multilinguality, Multimodality, and Interaction","","","","10.1007/978-3-030-85251-1_23","Bogdan IonescuHenning MüllerRenaud PéteriAsma Ben AbachaMourad SarroutiDina Demner-FushmanSadid A. HasanSerge KozlovskiVitali LiauchukYashin Dicente CidVassili KovalevObioma PelkaAlba García Seco de HerreraJanadhip JacutprakartChristoph M. FriedrichRaul Berari","2021","http://link.springer.com/chapter/10.1007/978-3-030-85251-1_23","Chapter"
"Look, Read and Ask: Learning to Ask Questions by Reading Text in Images","Document Analysis and Recognition – ICDAR 2021","","","","10.1007/978-3-030-86549-8_22","Soumya JahagirdarShankar GangisettyAnand Mishra","2021","http://link.springer.com/chapter/10.1007/978-3-030-86549-8_22","Chapter"
"Dowsing for Math Answers","Experimental IR Meets Multilinguality, Multimodality, and Interaction","","","","10.1007/978-3-030-85251-1_16","Yin Ki NgDallas J. FraserBesat KassaieFrank Wm. Tompa","2021","http://link.springer.com/chapter/10.1007/978-3-030-85251-1_16","Chapter"
"Knowledge-lean Paraphrase Identification Using Character-Based Features","Artificial Intelligence and Natural Language","","","","10.1007/978-3-319-71746-3_21","Asli EyeciogluBill Keller","2018","http://link.springer.com/chapter/10.1007/978-3-319-71746-3_21","Chapter"
"Automatically Constructing Concept Hierarchies of Health-Related Human Goals","Knowledge Science, Engineering and Management","","","","10.1007/978-3-642-25975-3_12","Mark KröllYusuke FukazawaJun OtaMarkus Strohmaier","2011","http://link.springer.com/chapter/10.1007/978-3-642-25975-3_12","Chapter"
"Information Retrieval and Web Search","Web Data Mining","","","","10.1007/978-3-642-19460-3_6","Bing Liu","2011","http://link.springer.com/chapter/10.1007/978-3-642-19460-3_6","Chapter"
"Overview of INEX 2014","Information Access Evaluation. Multilinguality, Multimodality, and Interaction","","","","10.1007/978-3-319-11382-1_19","Patrice BellotToine BogersShlomo GevaMark HallHugo HuurdemanJaap KampsGabriella KazaiMarijn KoolenVéronique MoriceauJosiane MotheMichael PremingerEric SanJuanRalf SchenkelMette SkovXavier TannierDavid Walsh","2014","http://link.springer.com/chapter/10.1007/978-3-319-11382-1_19","Chapter"
"A Discriminative Possibilistic Approach for Query Translation Disambiguation","Natural Language Processing and Information Systems","","","","10.1007/978-3-319-59569-6_45","Wiem Ben RomdhaneBilel ElayebNarjès Bellamine Ben Saoud","2017","http://link.springer.com/chapter/10.1007/978-3-319-59569-6_45","Chapter"
"Inferring Paraphrases for a Highly Inflected Language from a Monolingual Corpus","Computational Linguistics and Intelligent Text Processing","","","","10.1007/978-3-642-54903-8_22","Kfir BarNachum Dershowitz","2014","http://link.springer.com/chapter/10.1007/978-3-642-54903-8_22","Chapter"
"Overview of ARQMath 2020: CLEF Lab on Answer Retrieval for Questions on Math","Experimental IR Meets Multilinguality, Multimodality, and Interaction","","","","10.1007/978-3-030-58219-7_15","Richard ZanibbiDouglas W. OardAnurag AgarwalBehrooz Mansouri","2020","http://link.springer.com/chapter/10.1007/978-3-030-58219-7_15","Chapter"
"Evaluating Topic Models in Portuguese Political Comments About Bills from Brazil’s Chamber of Deputies","Intelligent Systems","","","","10.1007/978-3-030-91699-2_8","Nádia F. F. da SilvaMarília Costa R. SilvaFabíola S. F. PereiraJoão Pedro M. TarregaJoão Vitor P. BeinottiMárcio FonsecaFrancisco Edmundo de AndradeAndré C. P. de L. F. de Carvalho","2021","http://link.springer.com/chapter/10.1007/978-3-030-91699-2_8","Chapter"
"Exploiting Siamese Neural Networks on Short Text Similarity Tasks for Multiple Domains and Languages","Computational Processing of the Portuguese Language","","","","10.1007/978-3-030-41505-1_34","João Vitor Andrioli de SouzaLucas Emanuel Silva E OliveiraYohan Bonescki GumielDeborah Ribeiro CarvalhoClaudia Maria Cabral Moro","2020","http://link.springer.com/chapter/10.1007/978-3-030-41505-1_34","Chapter"
"Open-Domain Multi-Document Summarization via Information Extraction: Challenges and Prospects","Multi-source, Multilingual Information Extraction and Summarization","","","","10.1007/978-3-642-28569-1_9","Heng JiBenoit FavreWen-Pin LinDan GillickDilek Hakkani-TurRalph Grishman","2013","http://link.springer.com/chapter/10.1007/978-3-642-28569-1_9","Chapter"
"Tools and QA","Practical Web Inclusion and Accessibility","","","","10.1007/978-1-4842-5452-3_11","Ashley Firth","2019","http://link.springer.com/chapter/10.1007/978-1-4842-5452-3_11","Chapter"
"Metrics, Statistics, Tests","Bridging Between Information Retrieval and Databases","","","","10.1007/978-3-642-54798-0_6","Tetsuya Sakai","2014","http://link.springer.com/chapter/10.1007/978-3-642-54798-0_6","Chapter"
"Automatic Translation and Multilingual Cultural Heritage Retrieval: A Case Study with Transcriptions in Europeana","Linking Theory and Practice of Digital Libraries","","","","10.1007/978-3-030-86324-1_17","Mónica MarreroAntoine IsaacNuno Freire","2021","http://link.springer.com/chapter/10.1007/978-3-030-86324-1_17","Chapter"
"Token-Level Multilingual Epidemic Dataset for Event Extraction","Linking Theory and Practice of Digital Libraries","","","","10.1007/978-3-030-86324-1_6","Stephen MutuviEmanuela BorosAntoine DoucetGaël LejeuneAdam JatowtMoses Odeo","2021","http://link.springer.com/chapter/10.1007/978-3-030-86324-1_6","Chapter"
"Language Technology 2020: The Meta-Net Technology Vision","META-NET Strategic Research Agenda for Multilingual Europe 2020","","","","10.1007/978-3-642-36349-8_5","Georg RehmHans Uszkoreit","2013","http://link.springer.com/chapter/10.1007/978-3-642-36349-8_5","Chapter"
"Recognizing Textual Entailment in Non-english Text via Automatic Translation into English","Advances in Computational Intelligence","","","","10.1007/978-3-642-37798-3_3","Partha PakraySnehasis NeogiSivaji BandyopadhyayAlexander Gelbukh","2013","http://link.springer.com/chapter/10.1007/978-3-642-37798-3_3","Chapter"
"Focusing on Odds and Ends","Learn Java for Android Development","","","","10.1007/978-1-4302-6455-2_16","Jeff Friesen","2014","http://link.springer.com/chapter/10.1007/978-1-4302-6455-2_16","Chapter"
"Localization of EHCPRs System in the Multilingual Domain: An Implementation","Information Systems for Indian Languages","","","","10.1007/978-3-642-19403-0_61","Sarika JainDeepa ChaudharyN. K. Jain","2011","http://link.springer.com/chapter/10.1007/978-3-642-19403-0_61","Chapter"
"Automatic Image Annotation at ImageCLEF","Information Retrieval Evaluation in a Changing World","","","","10.1007/978-3-030-22948-1_11","Josiah WangAndrew GilbertBart ThomeeMauricio Villegas","2019","http://link.springer.com/chapter/10.1007/978-3-030-22948-1_11","Chapter"
"Europeana v1.0","Digital Libraries and Archives","","","","10.1007/978-3-642-27302-5_16","Nicola AloiaCesare ConcordiaCarlo Meghini","2011","http://link.springer.com/chapter/10.1007/978-3-642-27302-5_16","Chapter"
"Cross-Media Analysis for Communication during Natural Disasters","Advances in Information Technology","","","","10.1007/978-3-319-03783-7_2","Gerhard BackfriedJohannes GöllnerGerald QuirchmayrKarin RainerGert KienastGeorg ThallingerChristian SchmidtMark PfeifferChristian MeurersAndreas Peer","2013","http://link.springer.com/chapter/10.1007/978-3-319-03783-7_2","Chapter"
"An Unsupervised Method for Linking Entity Mentions in Chinese Text","Advances in Services Computing","","","","10.1007/978-3-319-49178-3_14","Jing XuLiang GanBin ZhouQuanyuan Wu","2016","http://link.springer.com/chapter/10.1007/978-3-319-49178-3_14","Chapter"
"A Quarter of Century in Artificial Intelligence and Law: Projects, Personal Trajectories, a Subjective Perspective","Language, Culture, Computation. Computing of the Humanities, Law, and Narratives","","","","10.1007/978-3-642-45324-3_16","Ephraim NissanCarmelo AsaroAldo Franco DragoniDany Yamen FarookSolomon Eyal Shimony","2014","http://link.springer.com/chapter/10.1007/978-3-642-45324-3_16","Chapter"
"Engaging Practitioners within Design Science Research: A Natural Language Processing Case Study","Design Science: Perspectives from Europe","","","","10.1007/978-3-319-04090-5_14","Seán O’RiainEdward CurryPaul Buitelaar","2013","http://link.springer.com/chapter/10.1007/978-3-319-04090-5_14","Chapter"
"The SMGloM Project and System: Towards a Terminology and Ontology for Mathematics","Mathematical Software – ICMS 2016","","","","10.1007/978-3-319-42432-3_58","Deyan GinevMihnea IancuConstantin JucovshiAndrea KohlhaseMichael KohlhaseAkbar OripovJürgen SchefterWolfram SperberOlaf TeschkeTom Wiesing","2016","http://link.springer.com/chapter/10.1007/978-3-319-42432-3_58","Chapter"
"A Pinch of Humor for Short-Text Conversation: An Information Retrieval Approach","Experimental IR Meets Multilinguality, Multimodality, and Interaction","","","","10.1007/978-3-319-65813-1_1","Vladislav BlinovKirill MishchenkoValeria BolotovaPavel Braslavski","2017","http://link.springer.com/chapter/10.1007/978-3-319-65813-1_1","Chapter"
"Information Extraction and Semantic Annotation for Multi-Paradigm Information Management","Current Challenges in Patent Information Retrieval","","","","10.1007/978-3-642-19231-9_15","Hamish CunninghamValentin TablanIan RobertsMark A. GreenwoodNiraj Aswani","2011","http://link.springer.com/chapter/10.1007/978-3-642-19231-9_15","Chapter"
"RAGA: Relation-Aware Graph Attention Networks for Global Entity Alignment","Advances in Knowledge Discovery and Data Mining","","","","10.1007/978-3-030-75762-5_40","Renbo ZhuMeng MaPing Wang","2021","http://link.springer.com/chapter/10.1007/978-3-030-75762-5_40","Chapter"
"What Computers Can’t Do–Yet","Social Machines","","","","10.1007/978-1-4842-1156-4_5","James HendlerAlice M. Mulvehill","2016","http://link.springer.com/chapter/10.1007/978-1-4842-1156-4_5","Chapter"
"A Case Study of Closed-Domain Response Suggestion with Limited Training Data","Database and Expert Systems Applications","","","","10.1007/978-3-319-99133-7_18","Lukas GalkeGunnar GerstenkornAnsgar Scherp","2018","http://link.springer.com/chapter/10.1007/978-3-319-99133-7_18","Chapter"
"Overview of ARQMath-2 (2021): Second CLEF Lab on Answer Retrieval for Questions on Math","Experimental IR Meets Multilinguality, Multimodality, and Interaction","","","","10.1007/978-3-030-85251-1_17","Behrooz MansouriRichard ZanibbiDouglas W. OardAnurag Agarwal","2021","http://link.springer.com/chapter/10.1007/978-3-030-85251-1_17","Chapter"
"CULTURA: A Metadata-Rich Environment to Support the Enhanced Interrogation of Cultural Collections","Metadata and Semantics Research","","","","10.1007/978-3-642-35233-1_23","Cormac HampsonSeamus LawlessEoin BaileySivan YogevNaama ZwerdlingDavid CarmelOwen ConlanAlex O’ConnorVincent Wade","2012","http://link.springer.com/chapter/10.1007/978-3-642-35233-1_23","Chapter"
"Multi-document Text Summarization in E-learning System for Operating System Domain","Advances in Computing and Communications","","","","10.1007/978-3-642-22726-4_19","S. SaraswathiM. HemamaliniS. JananiV. Priyadharshini","2011","http://link.springer.com/chapter/10.1007/978-3-642-22726-4_19","Chapter"
"Developing an Ontology for Curriculum and Syllabus","The Semantic Web: ESWC 2018 Satellite Events","","","","10.1007/978-3-319-98192-5_11","Evangelos KatisHaridimos KondylakisGiannis AgathangelosKostas Vassilakis","2018","http://link.springer.com/chapter/10.1007/978-3-319-98192-5_11","Chapter"
"Looking for COVID-19 Misinformation in Multilingual Social Media Texts","New Trends in Database and Information Systems","","","","10.1007/978-3-030-85082-1_7","Raj Ratn PraneshMehrdad FarokhnejadAmbesh ShekharGenoveva Vargas-Solar","2021","http://link.springer.com/chapter/10.1007/978-3-030-85082-1_7","Chapter"
"About Sound and Vision: CLEF Beyond Text Retrieval Tasks","Information Retrieval Evaluation in a Changing World","","","","10.1007/978-3-030-22948-1_13","Gareth J. F. Jones","2019","http://link.springer.com/chapter/10.1007/978-3-030-22948-1_13","Chapter"
"Evaluation of Manual Query Expansion Rules on a Domain Specific FAQ Collection","Experimental IR Meets Multilinguality, Multimodality, and Interaction","","","","10.1007/978-3-319-24027-5_24","Mladen KaranJan Šnajder","2015","http://link.springer.com/chapter/10.1007/978-3-319-24027-5_24","Chapter"
"Automatic Fake News Detection with Pre-trained Transformer Models","Pattern Recognition. ICPR International Workshops and Challenges","","","","10.1007/978-3-030-68787-8_45","Mina SchützAlexander SchindlerMelanie SiegelKawa Nazemi","2021","http://link.springer.com/chapter/10.1007/978-3-030-68787-8_45","Chapter"
"Overview of ImageCLEF 2018: Challenges, Datasets and Evaluation","Experimental IR Meets Multilinguality, Multimodality, and Interaction","","","","10.1007/978-3-319-98932-7_28","Bogdan IonescuHenning MüllerMauricio VillegasAlba García Seco de HerreraCarsten EickhoffVincent AndrearczykYashin Dicente CidVitali LiauchukVassili KovalevSadid A. HasanYuan LingOladimeji FarriJoey LiuMatthew LungrenDuc-Tien Dang-NguyenLuca Piras","2018","http://link.springer.com/chapter/10.1007/978-3-319-98932-7_28","Chapter"
"Language Technology Support for Welsh","The Welsh Language in the Digital Age","","","","10.1007/978-3-642-45372-4_9","Jeremy Evas","2014","http://link.springer.com/chapter/10.1007/978-3-642-45372-4_9","Chapter"
"Shadow Answers as an Intermediary in Email Answer Retrieval","Experimental IR Meets Multilinguality, Multimodality, and Interaction","","","","10.1007/978-3-319-24027-5_18","Alyaa AlfalahiGunnar ErikssonEriks Sneiders","2015","http://link.springer.com/chapter/10.1007/978-3-319-24027-5_18","Chapter"
"Complex Reactivity with Preferences in Rule-Based Agents","Rules on the Web: Research and Applications","","","","10.1007/978-3-642-32689-9_13","Stefania CostantiniGiovanni De Gasperis","2012","http://link.springer.com/chapter/10.1007/978-3-642-32689-9_13","Chapter"
"A Methodological Approach to Integrate Ontology and Configurational Analysis","Computational Science and Its Applications – ICCSA 2014","","","","10.1007/978-3-319-09129-7_50","Antonia CataldoValerio Di PintoAntonio M. Rinaldi","2014","http://link.springer.com/chapter/10.1007/978-3-319-09129-7_50","Chapter"
"Regression Based Approaches for Detecting and Measuring Textual Similarity","Mining Intelligence and Knowledge Exploration","","","","10.1007/978-3-319-58130-9_14","Sandip SarkarPartha PakrayDipankar DasAlexander Gelbukh","2017","http://link.springer.com/chapter/10.1007/978-3-319-58130-9_14","Chapter"
"DNS Messages and Records","Pro DNS and BIND 10","","","","10.1007/978-1-4302-3049-6_15","Ron Aitchison","2011","http://link.springer.com/chapter/10.1007/978-1-4302-3049-6_15","Chapter"
"Quo Vadis: A Corpus of Entities and Relations","Language Production, Cognition, and the Lexicon","","","","10.1007/978-3-319-08043-7_28","Dan CristeaDaniela GîfuMihaela ColhonPaul DiacAnca-Diana BibiriCătălina MărănducLiviu-Andrei Scutelnicu","2015","http://link.springer.com/chapter/10.1007/978-3-319-08043-7_28","Chapter"
"Natural Language Processing, Understanding, and Generation","Building an Enterprise Chatbot","","","","10.1007/978-1-4842-5034-1_5","Abhishek SinghKarthik RamasubramanianShrey Shivam","2019","http://link.springer.com/chapter/10.1007/978-1-4842-5034-1_5","Chapter"
"Recognition","Computer Vision","","","","10.1007/978-3-030-34372-9_6","Richard Szeliski","2022","http://link.springer.com/chapter/10.1007/978-3-030-34372-9_6","Chapter"
"Methods of Efficiently Constructing Text-Dialogue-Agent System Using Existing Anime Character","HCI International 2020 – Late Breaking Papers: Interaction, Knowledge and Social Media","","","","10.1007/978-3-030-60152-2_25","Ryo IshiiRyuichiro HigashinakaKoh MitsudaTaichi KatayamaMasahiro MizukamiJunji TomitaHidetoshi KawabataEmi YamaguchiNoritake AdachiYushi Aono","2020","http://link.springer.com/chapter/10.1007/978-3-030-60152-2_25","Chapter"
"Enhancing E-commerce Using an Advanced Search Engine and Recommendation System","Natural Language Processing Projects","","","","10.1007/978-1-4842-7386-9_4","Akshay KulkarniAdarsha ShivanandaAnoosh Kulkarni","2022","http://link.springer.com/chapter/10.1007/978-1-4842-7386-9_4","Chapter"
"Construction of an English-Uyghur WordNet Dataset","Chinese Computational Linguistics","","","","10.1007/978-3-030-32381-3_31","Kahaerjiang AbiderexitiMaosong Sun","2019","http://link.springer.com/chapter/10.1007/978-3-030-32381-3_31","Chapter"
"Applications of SEQUAL","Model-Based Development and Evolution of Information Systems","","","","10.1007/978-1-4471-2936-3_7","John Krogstie","2012","http://link.springer.com/chapter/10.1007/978-1-4471-2936-3_7","Chapter"
"Valuable Language Resources and Applications Supporting the Use of Basque","Human Language Technology. Challenges for Computer Science and Linguistics","","","","10.1007/978-3-642-20095-3_30","Iñaki AlegriaMaxux AranzabeXabier ArregiXabier ArtolaArantza Díaz de IlarrazaAingeru MayorKepa Sarasola","2011","http://link.springer.com/chapter/10.1007/978-3-642-20095-3_30","Chapter"
"COLIEE 2020: Methods for Legal Document Retrieval and Entailment","New Frontiers in Artificial Intelligence","","","","10.1007/978-3-030-79942-7_13","Juliano RabeloMi-Young KimRandy GoebelMasaharu YoshiokaYoshinobu KanoKen Satoh","2021","http://link.springer.com/chapter/10.1007/978-3-030-79942-7_13","Chapter"
"The Scholarly Impact of CLEF 2010–2017","Information Retrieval Evaluation in a Changing World","","","","10.1007/978-3-030-22948-1_22","Birger Larsen","2019","http://link.springer.com/chapter/10.1007/978-3-030-22948-1_22","Chapter"
"Principled Pragmatism: A Guide to the Adaptation of Ideas from Philosophical Disciplines to Conceptual Modeling","Advances in Conceptual Modeling. Recent Developments and New Directions","","","","10.1007/978-3-642-24574-9_24","David W. EmbleyStephen W. LiddleDeryle W. Lonsdale","2011","http://link.springer.com/chapter/10.1007/978-3-642-24574-9_24","Chapter"
"Position-Aligned Translation Model for Citation Recommendation","String Processing and Information Retrieval","","","","10.1007/978-3-642-34109-0_27","Jing HeJian-Yun NieYang LuWayne Xin Zhao","2012","http://link.springer.com/chapter/10.1007/978-3-642-34109-0_27","Chapter"
"QweetFinder: Real-Time Finding and Filtering of Question Tweets","Advances in Information Retrieval","","","","10.1007/978-3-319-56608-5_79","Ameer AlbahemMaram HasanainMarwan TorkiTamer Elsayed","2017","http://link.springer.com/chapter/10.1007/978-3-319-56608-5_79","Chapter"
"An OpenCCG-Based Approach to Question Generation from Concepts","Natural Language Processing and Information Systems","","","","10.1007/978-3-642-38824-8_4","Markus M. BergAmy IsardJohanna D. Moore","2013","http://link.springer.com/chapter/10.1007/978-3-642-38824-8_4","Chapter"
"Learning from Others’ Experience","Artificial Companion for Second Language Conversation","","","","10.1007/978-3-030-15504-9_2","Sviatlana Höhn","2019","http://link.springer.com/chapter/10.1007/978-3-030-15504-9_2","Chapter"
"Sentiment Analysis in Social Streams","Emotions and Personality in Personalized Services","","","","10.1007/978-3-319-31413-6_7","Hassan SaifF. Javier OrtegaMiriam FernándezIván Cantador","2016","http://link.springer.com/chapter/10.1007/978-3-319-31413-6_7","Chapter"
"Statistical Machine Translation","Natural Language Processing of Semitic Languages","","","","10.1007/978-3-642-45358-8_6","Hany HassanKareem Darwish","2014","http://link.springer.com/chapter/10.1007/978-3-642-45358-8_6","Chapter"
"Attributes as Semantic Units Between Natural Language and Visual Recognition","Visual Attributes","","","","10.1007/978-3-319-50077-5_12","Marcus Rohrbach","2017","http://link.springer.com/chapter/10.1007/978-3-319-50077-5_12","Chapter"
"Harnessing Open Information Extraction for Entity Classification in a French Corpus","Advances in Artificial Intelligence","","","","10.1007/978-3-319-34111-8_20","Fabrizio GottiPhilippe Langlais","2016","http://link.springer.com/chapter/10.1007/978-3-319-34111-8_20","Chapter"
"Back to the Feature, in Entailment Detection and Similarity Measurement for Portuguese","Computational Processing of the Portuguese Language","","","","10.1007/978-3-030-41505-1_16","Pedro FialhoLuísa CoheurPaulo Quaresma","2020","http://link.springer.com/chapter/10.1007/978-3-030-41505-1_16","Chapter"
"A Social Promotion Chatbot","Developing Enterprise Chatbots","","","","10.1007/978-3-030-04299-8_12","Boris Galitsky","2019","http://link.springer.com/chapter/10.1007/978-3-030-04299-8_12","Chapter"
"Semantic Processing of Semitic Languages","Natural Language Processing of Semitic Languages","","","","10.1007/978-3-642-45358-8_4","Mona DiabYuval Marton","2014","http://link.springer.com/chapter/10.1007/978-3-642-45358-8_4","Chapter"
"SIGA, a System to Manage Information Retrieval Evaluations","Computational Processing of the Portuguese Language","","","","10.1007/978-3-642-28885-2_32","Luis CostaCristina MotaDiana Santos","2012","http://link.springer.com/chapter/10.1007/978-3-642-28885-2_32","Chapter"
"Extraction of Domain-Specific Concepts to Create Expertise Profiles","Global Trends in Computing and Communication Systems","","","","10.1007/978-3-642-29219-4_85","Gagandeep KaurS. K. JainSaurabh ParmarAnand Kumar","2012","http://link.springer.com/chapter/10.1007/978-3-642-29219-4_85","Chapter"
"Link Analysis for Representing and Retrieving Legal Information","Computational Linguistics and Intelligent Text Processing","","","","10.1007/978-3-642-37256-8_32","Alfredo López MonroyHiram CalvoAlexander GelbukhGeorgina García Pacheco","2013","http://link.springer.com/chapter/10.1007/978-3-642-37256-8_32","Chapter"
"Retrieving Time from Scanned Books","Advances in Information Retrieval","","","","10.1007/978-3-319-16354-3_24","John FoleyJames Allan","2015","http://link.springer.com/chapter/10.1007/978-3-319-16354-3_24","Chapter"
"Application Layer and Internet Applications","Internetworking","","","","10.1007/978-3-642-35392-5_9","Christoph MeinelHarald Sack","2013","http://link.springer.com/chapter/10.1007/978-3-642-35392-5_9","Chapter"
"Domain Specific Search","Professional Search in the Modern World","","","","10.1007/978-3-319-12511-4_6","Mihai LupuMichail SalampasisAllan Hanbury","2014","http://link.springer.com/chapter/10.1007/978-3-319-12511-4_6","Chapter"
