Item Title,Publication Title,Book Series Title,Journal Volume,Journal Issue,Item DOI,Authors,Publication Year,URL,Content Type
"Adaptive Entity Alignment for Cross-Lingual Knowledge Graph","Knowledge Science, Engineering and Management","","","","10.1007/978-3-030-82147-0_39","Yuanming ZhangTianyu GaoJiawei LuZhenbo ChengGang Xiao","2021","http://link.springer.com/chapter/10.1007/978-3-030-82147-0_39","Chapter"
"HealthQA: A Chinese QA Summary System for Smart Health","Smart Health","","","","10.1007/978-3-319-08416-9_6","Yanshen YinYong ZhangXiao LiuYan ZhangChunxiao XingHsinchun Chen","2014","http://link.springer.com/chapter/10.1007/978-3-319-08416-9_6","Chapter"
"Component-Based Evaluation for Question Answering","Evaluating Information Retrieval and Access Tasks","","","","10.1007/978-981-15-5554-1_8","Teruko MitamuraEric Nyberg","2021","http://link.springer.com/chapter/10.1007/978-981-15-5554-1_8","Chapter"
"Global Trends","The Development of Natural Language Processing","","","","10.1007/978-981-16-1986-1_1","","2021","http://link.springer.com/chapter/10.1007/978-981-16-1986-1_1","Chapter"
"Boosting Lexical Resources for the Semantic Web: Generative Lexicon and Lexicon Interoperability","Advances in Generative Lexicon Theory","","","","10.1007/978-94-007-5189-7_18","Nicoletta CalzolariFrancesca BertagnaAlessandro LenciMonica Monachini","2013","http://link.springer.com/chapter/10.1007/978-94-007-5189-7_18","Chapter"
"A Web Knowledge Based Approach for Complex Question Answering","Information Retrieval Technology","","","","10.1007/978-3-642-25631-8_42","Han RenDonghong JiChong TengJing Wan","2011","http://link.springer.com/chapter/10.1007/978-3-642-25631-8_42","Chapter"
"Text and Speech Basics","Deep Learning for NLP and Speech Recognition","","","","10.1007/978-3-030-14596-5_3","Uday KamathJohn LiuJames Whitaker","2019","http://link.springer.com/chapter/10.1007/978-3-030-14596-5_3","Chapter"
"Cross-Lingual Entity Matching for Heterogeneous Online Wikis","Natural Language Processing and Chinese Computing","","","","10.1007/978-3-319-73618-1_78","Weiming LuPeng WangHuan WangJiahui LiuHao DaiBaogang Wei","2018","http://link.springer.com/chapter/10.1007/978-3-319-73618-1_78","Chapter"
"Research on Cross-lingual Machine Reading Comprehension Technology Based on Non-parallel Corpus","Artificial Intelligence and Security","","","","10.1007/978-981-15-8083-3_36","Zhao YiWang JinXuejie Zhang","2020","http://link.springer.com/chapter/10.1007/978-981-15-8083-3_36","Chapter"
"Semantic Reasoning with SPARQL in Heterogeneous Multi-context Systems","Advanced Information Systems Engineering Workshops","","","","10.1007/978-3-642-22056-2_59","Peter SchüllerAntonius Weinzierl","2011","http://link.springer.com/chapter/10.1007/978-3-642-22056-2_59","Chapter"
"Semantic Recommendation System for Bilingual Corpus of Academic Papers","Recent Trends in Analysis of Images, Social Networks and Texts","","","","10.1007/978-3-030-71214-3_3","Anna SafaryanPetr FilchenkovWeijia YanAndrey KutuzovIrina Nikishina","2021","http://link.springer.com/chapter/10.1007/978-3-030-71214-3_3","Chapter"
"Automatic Extraction of Medical Term Variants from Multilingual Parallel Translations","Interactive Multi-modal Question-Answering","","","","10.1007/978-3-642-17525-1_7","Lonneke van der PlasJörg TiedemannIsmail Fahmi","2011","http://link.springer.com/chapter/10.1007/978-3-642-17525-1_7","Chapter"
"OntoAQ: Ontology-Based Flexible Querying System for Farmers","Geospatial Infrastructure, Applications and Technologies: India Case Studies","","","","10.1007/978-981-13-2330-0_16","S. SahniN. AroraS. SenN. L. Sarda","2018","http://link.springer.com/chapter/10.1007/978-981-13-2330-0_16","Chapter"
"Relation Extraction from the Web Using Distant Supervision","Knowledge Engineering and Knowledge Management","","","","10.1007/978-3-319-13704-9_3","Isabelle AugensteinDiana MaynardFabio Ciravegna","2014","http://link.springer.com/chapter/10.1007/978-3-319-13704-9_3","Chapter"
"WeDGeM: A Domain-Specific Evaluation Dataset Generator for Multilingual Entity Linking Systems","Web Information Systems Engineering – WISE 2017","","","","10.1007/978-3-319-68786-5_18","Emrah InanOguz Dikenelli","2017","http://link.springer.com/chapter/10.1007/978-3-319-68786-5_18","Chapter"
"Analysis and Refinement of Cross-Lingual Entity Linking","Information Access Evaluation. Multilinguality, Multimodality, and Visual Analytics","","","","10.1007/978-3-642-33247-0_1","Taylor CassidyHeng JiHongbo DengJing ZhengJiawei Han","2012","http://link.springer.com/chapter/10.1007/978-3-642-33247-0_1","Chapter"
"Towards Knowledge Graphs Federations: Issues and Technologies","Web and Big Data. APWeb-WAIM 2020 International Workshops","","","","10.1007/978-981-16-0479-9_6","Xiang Zhao","2021","http://link.springer.com/chapter/10.1007/978-981-16-0479-9_6","Chapter"
"A Brief State of the Art of CNLs for Ontology Authoring","Controlled Natural Language","","","","10.1007/978-3-319-10223-8_18","Hazem SafwatBrian Davis","2014","http://link.springer.com/chapter/10.1007/978-3-319-10223-8_18","Chapter"
"Conceptual Search for Arabic Web Content","Computational Linguistics and Intelligent Text Processing","","","","10.1007/978-3-319-18117-2_30","Aya M. Al-ZoghbyKhaled Shaalan","2015","http://link.springer.com/chapter/10.1007/978-3-319-18117-2_30","Chapter"
"Graph Neural Networks in Natural Language Processing","Graph Neural Networks: Foundations, Frontiers, and Applications","","","","10.1007/978-981-16-6054-2_21","Bang LiuLingfei Wu","2022","http://link.springer.com/chapter/10.1007/978-981-16-6054-2_21","Chapter"
"Semantic Traffic Diagnosis with STAR-CITY: Architecture and Lessons Learned from Deployment in Dublin, Bologna, Miami and Rio","The Semantic Web – ISWC 2014","","","","10.1007/978-3-319-11915-1_19","Freddy LécuéRobert TuckerSimone Tallevi-DiotalleviRahul NairYiannis GkoufasGiuseppe LiguoriMauro BorioniAlexandre RademakerLuciano Barbosa","2014","http://link.springer.com/chapter/10.1007/978-3-319-11915-1_19","Chapter"
"Learning to Predict the Departure Dynamics of Wikidata Editors","The Semantic Web – ISWC 2021","","","","10.1007/978-3-030-88361-4_3","Guangyuan PiaoWeipeng Huang","2021","http://link.springer.com/chapter/10.1007/978-3-030-88361-4_3","Chapter"
"Lemonade: A Web Assistant for Creating and Debugging Ontology Lexica","Natural Language Processing and Information Systems","","","","10.1007/978-3-319-19581-0_45","Mariano RicoChristina Unger","2015","http://link.springer.com/chapter/10.1007/978-3-319-19581-0_45","Chapter"
"Linking Lexical Resources and Ontologies on the Semantic Web with Lemon","The Semantic Web: Research and Applications","","","","10.1007/978-3-642-21034-1_17","John McCraeDennis SpohrPhilipp Cimiano","2011","http://link.springer.com/chapter/10.1007/978-3-642-21034-1_17","Chapter"
"Integrating Wiki Systems, Natural Language Processing, and Semantic Technologies for Cultural Heritage Data Management","Language Technology for Cultural Heritage","","","","10.1007/978-3-642-20227-8_12","René WitteThomas KapplerRalf KrestelPeter C. Lockemann","2011","http://link.springer.com/chapter/10.1007/978-3-642-20227-8_12","Chapter"
"Ranking Multilingual Documents Using Minimal Language Dependent Resources","Computational Linguistics and Intelligent Text Processing","","","","10.1007/978-3-642-19437-5_17","G. S. K. SantoshN. Kiran KumarVasudeva Varma","2011","http://link.springer.com/chapter/10.1007/978-3-642-19437-5_17","Chapter"
"JarKA: Modeling Attribute Interactions for Cross-lingual Knowledge Alignment","Advances in Knowledge Discovery and Data Mining","","","","10.1007/978-3-030-47426-3_65","Bo ChenJing ZhangXiaobin TangHong ChenCuiping Li","2020","http://link.springer.com/chapter/10.1007/978-3-030-47426-3_65","Chapter"
"Building Wikipedia Ontology with More Semi-structured Information Resources","Semantic Technology","","","","10.1007/978-3-319-70682-5_1","Tokio KawakamiTakeshi MoritaTakahira Yamaguchi","2017","http://link.springer.com/chapter/10.1007/978-3-319-70682-5_1","Chapter"
"Data-Driven Methods for SMS-Based FAQ Retrieval","Multilingual Information Access in South Asian Languages","","","","10.1007/978-3-642-40087-2_11","Sanmitra BhattacharyaHung TranPadmini Srinivasan","2013","http://link.springer.com/chapter/10.1007/978-3-642-40087-2_11","Chapter"
"KEYSTONE WG2: Activities and Results Overview on Keyword Search","Semantic Keyword-Based Search on Structured Data Sources","","","","10.1007/978-3-319-74497-1_21","Julian SzymańskiElena Demidova","2018","http://link.springer.com/chapter/10.1007/978-3-319-74497-1_21","Chapter"
"Ontology Based Segmentation of Geo-Referenced Queries","Current Trends in Web Engineering","","","","10.1007/978-3-642-27997-3_13","Mamoun Abu Helou","2012","http://link.springer.com/chapter/10.1007/978-3-642-27997-3_13","Chapter"
"Wordnet – a Basic Resource for Natural Language Processing: The Case of plWordNet","Advances in Computational Collective Intelligence","","","","10.1007/978-3-030-63119-2_56","Agnieszka DziobTomasz Naskręt","2020","http://link.springer.com/chapter/10.1007/978-3-030-63119-2_56","Chapter"
"WebShodh: A Code Mixed Factoid Question Answering System for Web","Experimental IR Meets Multilinguality, Multimodality, and Interaction","","","","10.1007/978-3-319-65813-1_9","Khyathi Raghavi ChanduManoj ChinnakotlaAlan W. BlackManish Shrivastava","2017","http://link.springer.com/chapter/10.1007/978-3-319-65813-1_9","Chapter"
"QA4MRE 2011-2013: Overview of Question Answering for Machine Reading Evaluation","Information Access Evaluation. Multilinguality, Multimodality, and Visualization","","","","10.1007/978-3-642-40802-1_29","Anselmo PeñasEduard HovyPamela FornerÁlvaro RodrigoRichard SutcliffeRoser Morante","2013","http://link.springer.com/chapter/10.1007/978-3-642-40802-1_29","Chapter"
"Evaluating Multilingual Text Encoders for Unsupervised Cross-Lingual Retrieval","Advances in  Information Retrieval","","","","10.1007/978-3-030-72113-8_23","Robert LitschkoIvan VulićSimone Paolo PonzettoGoran Glavaš","2021","http://link.springer.com/chapter/10.1007/978-3-030-72113-8_23","Chapter"
"Future Patent Search","Current Challenges in Patent Information Retrieval","","","","10.1007/978-3-662-53817-3_17","Barrou DialloMihai Lupu","2017","http://link.springer.com/chapter/10.1007/978-3-662-53817-3_17","Chapter"
"Evaluating Data Quality in Europeana: Metrics for Multilinguality","Metadata and Semantic Research","","","","10.1007/978-3-030-14401-2_19","Péter KirályJuliane StillerValentine CharlesWerner BailerNuno Freire","2019","http://link.springer.com/chapter/10.1007/978-3-030-14401-2_19","Chapter"
"Steps towards Scenario-Based Programming with a Natural Language Interface","From Programs to Systems. The Systems perspective in Computing","","","","10.1007/978-3-642-54848-2_9","Michal GordonDavid Harel","2014","http://link.springer.com/chapter/10.1007/978-3-642-54848-2_9","Chapter"
"Overview of BioASQ 2021: The Ninth BioASQ Challenge on Large-Scale Biomedical Semantic Indexing and Question Answering","Experimental IR Meets Multilinguality, Multimodality, and Interaction","","","","10.1007/978-3-030-85251-1_18","Anastasios NentidisGeorgios KatsimprasEirini VandorouAnastasia KritharaLuis GascoMartin KrallingerGeorgios Paliouras","2021","http://link.springer.com/chapter/10.1007/978-3-030-85251-1_18","Chapter"
"A Dialogue System for Telugu, a Resource-Poor Language","Computational Linguistics and Intelligent Text Processing","","","","10.1007/978-3-319-18117-2_27","Mullapudi Ch. SravanthiKuncham PrathyushaRadhika Mamidi","2015","http://link.springer.com/chapter/10.1007/978-3-319-18117-2_27","Chapter"
"A Marker Passing Approach to Winograd Schemas","Semantic Technology","","","","10.1007/978-3-030-04284-4_12","Johannes FähndrichSabine WeberHannes Kanthak","2018","http://link.springer.com/chapter/10.1007/978-3-030-04284-4_12","Chapter"
"On the Role of Senses in the Ontology-Lexicon","New Trends of Research in Ontologies and Lexical Resources","","","","10.1007/978-3-642-31782-8_4","Philipp CimianoJohn McCraePaul BuitelaarElena Montiel-Ponsoda","2013","http://link.springer.com/chapter/10.1007/978-3-642-31782-8_4","Chapter"
"Case Studies","Friendly Interfaces Between Humans and Machines","","","","10.1007/978-981-13-1750-7_6","P. V. S. RaoSunil Kumar Kopparapu","2018","http://link.springer.com/chapter/10.1007/978-981-13-1750-7_6","Chapter"
"Vision to Language: Methods, Metrics and Datasets","Machine Learning Paradigms","","","","10.1007/978-3-030-49724-8_2","Naeha SharifUzair NadeemSyed Afaq Ali ShahMohammed BennamounWei Liu","2020","http://link.springer.com/chapter/10.1007/978-3-030-49724-8_2","Chapter"
"Improving Question-Answering for Portuguese Using Triples Extracted from Corpora","Computational Processing of the Portuguese Language","","","","10.1007/978-3-319-41552-9_3","Ricardo RodriguesPaulo Gomes","2016","http://link.springer.com/chapter/10.1007/978-3-319-41552-9_3","Chapter"
"A General Framework for Multiple Choice Question Answering Based on Mutual Information and Reinforced Co-occurrence","Transactions on Large-Scale Data- and Knowledge-Centered Systems XLII","","","","10.1007/978-3-662-60531-8_4","Jorge Martinez-GilBernhard FreudenthalerA Min Tjoa","2019","http://link.springer.com/chapter/10.1007/978-3-662-60531-8_4","Chapter"
"Semantic Network Visualization of Cultural Heritage Data","Current Trends in Web Engineering","","","","10.1007/978-3-030-03056-8_28","Shaban ShabaniZhan LiuMaria Sokhn","2018","http://link.springer.com/chapter/10.1007/978-3-030-03056-8_28","Chapter"
"Neural Learning for Question Answering in Italian","AI*IA 2018 – Advances in Artificial Intelligence","","","","10.1007/978-3-030-03840-3_29","Danilo CroceAlexandra ZelenanskaRoberto Basili","2018","http://link.springer.com/chapter/10.1007/978-3-030-03840-3_29","Chapter"
"The State of Computational Morphology for Europe’s Languages and the META-NET Strategic Research Agenda","Systems and Frameworks for Computational Morphology","","","","10.1007/978-3-642-40486-3_1","Georg Rehm","2013","http://link.springer.com/chapter/10.1007/978-3-642-40486-3_1","Chapter"
"Inter-disciplinary Interoperability for Global Sustainability Research","GeoSpatial Semantics","","","","10.1007/978-3-642-20630-6_1","Massimo CragliaStefano NativiMattia SantoroLorenzino VaccariCristiano Fugazza","2011","http://link.springer.com/chapter/10.1007/978-3-642-20630-6_1","Chapter"
"Summary of the Demonstration and Poster Track","The Semantic Web: ESWC 2013 Satellite Events","","","","10.1007/978-3-642-41242-4_12","Miriam FernándezVanessa López","2013","http://link.springer.com/chapter/10.1007/978-3-642-41242-4_12","Chapter"
"Major Trends in Information and Communication Technologies","META-NET Strategic Research Agenda for Multilingual Europe 2020","","","","10.1007/978-3-642-36349-8_3","Georg RehmHans Uszkoreit","2013","http://link.springer.com/chapter/10.1007/978-3-642-36349-8_3","Chapter"
"Overview of BioASQ 2020: The Eighth BioASQ Challenge on Large-Scale Biomedical Semantic Indexing and Question Answering","Experimental IR Meets Multilinguality, Multimodality, and Interaction","","","","10.1007/978-3-030-58219-7_16","Anastasios NentidisAnastasia KritharaKonstantinos BougiatiotisMartin KrallingerCarlos Rodriguez-PenagosMarta VillegasGeorgios Paliouras","2020","http://link.springer.com/chapter/10.1007/978-3-030-58219-7_16","Chapter"
"Name Entity Recognition for Malay Texts Using Cross-Lingual Annotation Projection Approach","Computational Science and Its Applications -- ICCSA 2015","","","","10.1007/978-3-319-21404-7_18","Norshuhani ZaminZainab Abu Bakar","2015","http://link.springer.com/chapter/10.1007/978-3-319-21404-7_18","Chapter"
"Natural Language Processing and Speech","Introduction to Deep Learning Business Applications for Developers","","","","10.1007/978-1-4842-3453-2_5","Armando VieiraBernardete Ribeiro","2018","http://link.springer.com/chapter/10.1007/978-1-4842-3453-2_5","Chapter"
"A Framework for Learning Cross-Lingual Word Embedding with Topics","Web and Big Data","","","","10.1007/978-3-030-60290-1_22","Xiaoya PengDong Zhou","2020","http://link.springer.com/chapter/10.1007/978-3-030-60290-1_22","Chapter"
"Entity Linking","Entity-Oriented Search","","","","10.1007/978-3-319-93935-3_5","Krisztian Balog","2018","http://link.springer.com/chapter/10.1007/978-3-319-93935-3_5","Chapter"
"From Global Terminology to Local Terminology: A Review on Cross-Cultural Interface Design Solutions","Cross-Cultural Design. Methods, Practice, and Case Studies","","","","10.1007/978-3-642-39143-9_22","Elke DunckerJaved Anjum SheikhBob Fields","2013","http://link.springer.com/chapter/10.1007/978-3-642-39143-9_22","Chapter"
"XLink: An Unsupervised Bilingual Entity Linking System","Chinese Computational Linguistics and Natural Language Processing Based on Naturally Annotated Big Data","","","","10.1007/978-3-319-69005-6_15","Jing ZhangYixin CaoLei HouJuanzi LiHai-Tao Zheng","2017","http://link.springer.com/chapter/10.1007/978-3-319-69005-6_15","Chapter"
"Scene Graph Prediction with Concept Knowledge Base","Cognitive Systems and Information Processing","","","","10.1007/978-981-16-9247-5_23","Runqing MiaoQingxuan Jia","2022","http://link.springer.com/chapter/10.1007/978-981-16-9247-5_23","Chapter"
"BAX-SET PLUS: A Taxonomic Navigation Model to Categorize, Search and Retrieve Semantic Web Services","Recent Progress in Data Engineering and Internet Technology","","","","10.1007/978-3-642-28807-4_50","Jaime Alberto Guzmán LunaIngrid Durley Torres PardoJovani Alberto Jiménez Builes","2013","http://link.springer.com/chapter/10.1007/978-3-642-28807-4_50","Chapter"
"Entity Alignment Between Knowledge Graphs Using Entity Type Matching","Knowledge Science, Engineering and Management","","","","10.1007/978-3-030-82136-4_47","Xiuting SongHan ZhangLuyi Bai","2021","http://link.springer.com/chapter/10.1007/978-3-030-82136-4_47","Chapter"
"Talking Open Data","The Semantic Web: ESWC 2017 Satellite Events","","","","10.1007/978-3-319-70407-4_25","Sebastian NeumaierVadim SavenkovSvitlana Vakulenko","2017","http://link.springer.com/chapter/10.1007/978-3-319-70407-4_25","Chapter"
"Meta-Learning for Multimedia","Automated Machine Learning and Meta-Learning for Multimedia","","","","10.1007/978-3-030-88132-0_4","Wenwu ZhuXin Wang","2021","http://link.springer.com/chapter/10.1007/978-3-030-88132-0_4","Chapter"
"Introduction","A Knowledge Representation Practionary","","","","10.1007/978-3-319-98092-8_1","Michael K. Bergman","2018","http://link.springer.com/chapter/10.1007/978-3-319-98092-8_1","Chapter"
"Reading Comprehension in Czech via Machine Translation and Cross-Lingual Transfer","Text, Speech, and Dialogue","","","","10.1007/978-3-030-58323-1_18","Kateřina MackováMilan Straka","2020","http://link.springer.com/chapter/10.1007/978-3-030-58323-1_18","Chapter"
"Relation Extraction for Open and Closed Domain Question Answering","Interactive Multi-modal Question-Answering","","","","10.1007/978-3-642-17525-1_8","Gosse BoumaIsmail FahmiJori Mur","2011","http://link.springer.com/chapter/10.1007/978-3-642-17525-1_8","Chapter"
"Conclusion","Managing Data From Knowledge Bases: Querying and Extraction","","","","10.1007/978-3-319-94935-2_7","Wei Emma ZhangQuan Z. Sheng","2018","http://link.springer.com/chapter/10.1007/978-3-319-94935-2_7","Chapter"
"Real Conversation with Human-Machine 24/7 COVID-19 Chatbot Based on Knowledge Graph Contextual Search","Data Science and Computational Intelligence","","","","10.1007/978-3-030-91244-4_21","Tanuja PatgarRipal PatelS. Girija","2021","http://link.springer.com/chapter/10.1007/978-3-030-91244-4_21","Chapter"
"Towards Semantic Interoperability in Historical Research: Documenting Research Data and Knowledge with Synthesis","The Semantic Web – ISWC 2021","","","","10.1007/978-3-030-88361-4_40","Pavlos FafaliosKonstantina KonsolakiLida CharamiKostas PetrakisManos PaterakisDimitris AngelakisYannis TzitzikasChrysoula BekiariMartin Doerr","2021","http://link.springer.com/chapter/10.1007/978-3-030-88361-4_40","Chapter"
"A Virtual Player for “Who Wants to Be a Millionaire?” based on Question Answering","AI*IA 2013: Advances in Artificial Intelligence","","","","10.1007/978-3-319-03524-6_18","Piero MolinoPierpaolo BasileCiro SantoroPasquale LopsMarco de GemmisGiovanni Semeraro","2013","http://link.springer.com/chapter/10.1007/978-3-319-03524-6_18","Chapter"
"Low-Resource Text Classification via Cross-Lingual Language Model Fine-Tuning","Chinese Computational Linguistics","","","","10.1007/978-3-030-63031-7_17","Xiuhong LiZhe LiJiabao ShengWushour Slamu","2020","http://link.springer.com/chapter/10.1007/978-3-030-63031-7_17","Chapter"
"Data Acquisition and Linguistic Resources","Handbook of Natural Language Processing and Machine Translation","","","","10.1007/978-1-4419-7713-7_1","Stephanie StrasselCaitlin ChristiansonJohn McCaryWilliam StadermanJoseph Olive","2011","http://link.springer.com/chapter/10.1007/978-1-4419-7713-7_1","Chapter"
"Talking in Italian About AI with a Chatbot: A Prototype of a Question-Answering Agent","Intelligent Data Engineering and Automated Learning – IDEAL 2020","","","","10.1007/978-3-030-62365-4_34","Chiara LeoniMauro CoccoliIlaria TorreGianni Vercelli","2020","http://link.springer.com/chapter/10.1007/978-3-030-62365-4_34","Chapter"
"Index-Based Semantic Tagging for Efficient Query Interpretation","Experimental IR Meets Multilinguality, Multimodality, and Interaction","","","","10.1007/978-3-319-44564-9_17","José DevezasSérgio Nunes","2016","http://link.springer.com/chapter/10.1007/978-3-319-44564-9_17","Chapter"
"Entity Translation with Collective Inference in Knowledge Graph","Natural Language Processing and Chinese Computing","","","","10.1007/978-3-319-25207-0_5","Qinglin LiShujie LiuRui LinMu LiMing Zhou","2015","http://link.springer.com/chapter/10.1007/978-3-319-25207-0_5","Chapter"
"Translation Induction on Indian Language Corpora Using Translingual Themes from Other Languages","Computational Linguistics and Intelligent Text Processing","","","","10.1007/978-3-319-18111-0_38","Goutham TholpadiChiranjib BhattacharyyaShirish Shevade","2015","http://link.springer.com/chapter/10.1007/978-3-319-18111-0_38","Chapter"
"A Survey of Artificial Intelligence Techniques on MOOC of Legal Education","Technology-Inspired Smart Learning for Future Education","","","","10.1007/978-981-15-5390-5_3","Yang WengXuejiao LiangHanyan DuanSongyuan GuNing WangZhu Wang","2020","http://link.springer.com/chapter/10.1007/978-981-15-5390-5_3","Chapter"
"Multilingual Europe: Facts, Challenges, Opportunities","META-NET Strategic Research Agenda for Multilingual Europe 2020","","","","10.1007/978-3-642-36349-8_2","Georg RehmHans Uszkoreit","2013","http://link.springer.com/chapter/10.1007/978-3-642-36349-8_2","Chapter"
"Core Technologies for the Internet of Services","Towards the Internet of Services: The THESEUS Research Program","","","","10.1007/978-3-319-06755-1_6","Tilman BeckerCatherina BurghartKawa NazemiPatrick Ndjiki-NyaThomas RiegelRalf SchäferThomas SporerVolker TrespJens Wissmann","2014","http://link.springer.com/chapter/10.1007/978-3-319-06755-1_6","Chapter"
"Challenges in Ontology Alignment and Solution to the Contradictory Evidence Problem","Advances in Artificial Intelligence and Its Applications","","","","10.1007/978-3-642-45114-0_16","Maria Vargas-VeraMiklos Nagy","2013","http://link.springer.com/chapter/10.1007/978-3-642-45114-0_16","Chapter"
"A Tutorial and Survey on Fault Knowledge Graph","Cyberspace Data and Intelligence, and Cyber-Living, Syndrome, and Health","","","","10.1007/978-981-15-1925-3_19","XiuQing WangShunKun Yang","2019","http://link.springer.com/chapter/10.1007/978-981-15-1925-3_19","Chapter"
"Cross-lingual Metaphor Paraphrase Detection – Experimental Corpus and Baselines","Information and Software Technologies","","","","10.1007/978-3-030-59506-7_28","Martin Víta","2020","http://link.springer.com/chapter/10.1007/978-3-030-59506-7_28","Chapter"
"Explass: Exploring Associations between Entities via Top-K Ontological Patterns and Facets","The Semantic Web – ISWC 2014","","","","10.1007/978-3-319-11915-1_27","Gong ChengYanan ZhangYuzhong Qu","2014","http://link.springer.com/chapter/10.1007/978-3-319-11915-1_27","Chapter"
"Towards Evolvable Ontology-Driven Development with Normalized Systems","Evaluation of Novel Approaches to Software Engineering","","","","10.1007/978-3-030-70006-5_9","Marek SuchánekHerwig MannaertPeter UhnákRobert Pergl","2021","http://link.springer.com/chapter/10.1007/978-3-030-70006-5_9","Chapter"
"Experiments on Portuguese Clinical Question Answering","Intelligent Systems","","","","10.1007/978-3-030-91699-2_10","Lucas Emanuel Silva e OliveiraElisa Terumi Rubel SchneiderYohan Bonescki GumielMayara Aparecida Passaura da LuzEmerson Cabrera ParaisoClaudia Moro","2021","http://link.springer.com/chapter/10.1007/978-3-030-91699-2_10","Chapter"
"Ontolex JeuxDeMots and Its Alignment to the Linguistic Linked Open Data Cloud","The Semantic Web – ISWC 2017","","","","10.1007/978-3-319-68288-4_40","Andon TchechmedjievThéophile MandonMathieu LafourcadeAnne LaurentKonstantin Todorov","2017","http://link.springer.com/chapter/10.1007/978-3-319-68288-4_40","Chapter"
"Literature Review of Arabic Question-Answering: Modeling, Generation, Experimentation and Performance Analysis","Flexible Query Answering Systems 2015","","","","10.1007/978-3-319-26154-6_25","Wided BakariPatrice BellotMahmoud Neji","2016","http://link.springer.com/chapter/10.1007/978-3-319-26154-6_25","Chapter"
"A Multilingual Semantic Similarity-Based Approach for Question-Answering Systems","Knowledge Science, Engineering and Management","","","","10.1007/978-3-030-29551-6_54","Wafa WaliFatma GhorbelBilel GragouriFayçal HamdiElisabeth Metais","2019","http://link.springer.com/chapter/10.1007/978-3-030-29551-6_54","Chapter"
